### ISSUE TITLE
[BUG] Graphite 1.1.7-2 is not showing/collecting all metric points

### ISSUE THREAD

**Issue by nikobearrr** [graphite-project/graphite-web#2613]
**Describe the bug**
We have moved our production graphite from 1.1.5-3 to 1.1.7-2 and we can see there are metrics which do not appear. I have setup a small example where I can see that I receive the same number of metrics, but it definitely doesn't look as expected. 

From the attached pictures you can see the same software, outputing the same metrics with the only difference being graphite's version. When running 1.1.7-2 there are a lot of data which does not show. When we switch to 1.1.5-3 for a period of ~30min only 2 data points are not showed. When using 1.1.5-13 for a period of ~20min all data points are there. However, the thing is that it doesn't happen all the time or immidiately. I saw this in production happen after several hours and then "fixes" itself. With 1.1.5-3 I have never observed that.

We are sending the data through statsd, graphite running in container. Test software sends every 10s with aggregation 10s:1h

**To Reproduce**

1. Setup some software which sends data to graphite
2. Setup grafana for observability (or use graphite-web)
3. Update graphite version to 1.1.7-2, let it run for some hours (days) and you might see it.

As I said in the previous step, I don't know why it happens and when. But I am definitely sure it's from the newer version as that's the only thing we changed.

**Expected behavior**
I would expect the latest version to work as good as previous version

**Screenshots**

This is the issue we observe
![graphite-v1 1 7-2](https://user-images.githubusercontent.com/8693064/83790297-06ae6e00-a6a9-11ea-8026-6f7bc34f845c.png)

On this screenshot you can see we have the same amount of metricsReceived before and after the update
![metrics-received](https://user-images.githubusercontent.com/8693064/83790263-f5fdf800-a6a8-11ea-845f-1b57a8d386c6.png)

**Environment (please complete the following information):**
 - OS flavor: docker
 - Graphite-web version 1.1.5-3, 1.1.7-2
 - Setup type: we use Dockerfile with custom storage schema config and udp.js:

Dockerfile:

```
FROM graphiteapp/graphite-statsd:1.1.6-1

ADD storage-schemas.conf /opt/graphite/conf/
ADD udp.js /opt/statsd/config/
```

udp.js:
```
{
  "graphiteHost": "127.0.0.1",
  "graphitePort": 2003,
  "port": 8125,
  "flushInterval": 10000,
  "servers": [
    { server: "./servers/udp", address: "0.0.0.0", port: 8125 }
  ],
  "deleteIdleStats": true
}
```

**Additional context**
The reason why I would like to update is because 1.1.5-3 doesn't rotate logs correctly

**Comment by piotr1212** [comment]
Strange, can't say what causes this, did you observer any other changes? cpu usage, memory, dropped metrics? Any chance you could try 1.1.6 to see from which release it started?

**Comment by nikobearrr** [comment]
Hi @piotr1212, I will try to run it with 1.1.6 and check if that happens as well. As as said, it's a bit harder to replicate as it does not happen immidiately and once it happens it fixes itself afterwards. The screenshots provided are from my test bench where they are running in the same environment (same host, same resources). We don't limit the graphite container and we are not reaching cpu/memory limits. We send data through UDP and on the interface we don't have any dropped packets. I can verify that I receive the `data` packet every 10s by using a tcpdump. And based on carbon's agent it also receives it, but doesn't process/persist it.

**Comment by deniszh** [comment]
@nikobearrr : please note that even if you  don't  limit the graphite container it's probably limited by default docker config.  You can run `docker inspect` to find out those limits.
We're not aware of any significat\nt performance regression in later releases, so, proboably you start hitting some limits....

**Comment by nikobearrr** [comment]
Hi @deniszh 

I cannot say that it hits some limit or doesn't since I have looked so much into it. The test service I am running runs on a 16CPU 32GB memory machine running Ubuntu 18.04LTS (sharing with some other services). As you can see in the picture above we receive about 15k metrics which I would say is not much at all. Using the same configuration in docker (and same server) we have had graphite 1.1.5-3 running for the last 1 year without any (noted) issues. We have switched to 1.1.7-2 and this happened within hours/days without changes into the carbon/service/deployment configuration, the only thing I changed was I bumped the version, built new image and deployed it. I say hours/days because I thought I did something wrong, but even after a restart it might take some hours or some days to reach this "state"

On our prod machine we run netdata, grafana and graphite on a 8CPU 16G host from which our CPU usage is rarely over 40% when "idling".(I cannot tell you the exact number of metrics now, but it's more than 15K/s). The cpu usage goes up when we browse through dashboards, but when only receiving data it's < 50%. Thus I doubt we are reaching a limit, or in the case we are, why do we not reach it with 1.1.5-3?

docker inspect returns this for the container:

```
{
    "ID": "rvfnl7uyx6dzm3sckexumnbp4",
    "Version": {
        "Index": 40859036
    },
    "CreatedAt": "2020-02-01T11:54:15.176381564Z",
    "UpdatedAt": "2020-06-05T08:23:50.42691396Z",
    "Spec": {
        "Name": "graphite_graphite",
        "Labels": {
            "com.docker.stack.image": "graphite/graphite:snapshot-200604-190008-0588",
            "com.docker.stack.namespace": "graphite"
        },
        "TaskTemplate": {
            "ContainerSpec": {
                "Image": "graphite/graphite:snapshot-200604-190008-0588@sha256:c462095432fde70842e39048be632102d577838d722dd52c8e2bdd5a3b45b43e",
                "Labels": {
                    "com.docker.stack.namespace": "graphite"
                },
                "Env": [
                    "REDIS_TAGDB=true"
                ],
                "Privileges": {
                    "CredentialSpec": null,
                    "SELinuxContext": null
                },
                "Mounts": [
                    {
                        "Type": "bind",
                        "Source": "/var/lib/graphite/storage/whisper",
                        "Target": "/opt/graphite/storage/whisper"
                    }
                ],
                "StopGracePeriod": 10000000000,
                "DNSConfig": {},
                "Isolation": "default"
            },
            "Resources": {},
            "RestartPolicy": {
                "Condition": "any",
                "Delay": 5000000000,
                "MaxAttempts": 0
            },
            "Placement": {
                "Constraints": [
                    "node.labels.graphite == true"
                ],
                "Platforms": [
                    {
                        "Architecture": "amd64",
                        "OS": "linux"
                    }
                ]
            },
            "Networks": [
                {
                    "Target": "eekt855l9trtcu79u7vzp7pv2",
                    "Aliases": [
                        "graphite"
                    ]
                }
            ],
            "ForceUpdate": 0,
            "Runtime": "container"
        },
        "Mode": {
            "Replicated": {
                "Replicas": 1
            }
        },
        "UpdateConfig": {
            "Parallelism": 1,
            "FailureAction": "pause",
            "Monitor": 5000000000,
            "MaxFailureRatio": 0,
            "Order": "stop-first"
        },
        "RollbackConfig": {
            "Parallelism": 1,
            "FailureAction": "pause",
            "Monitor": 5000000000,
            "MaxFailureRatio": 0,
            "Order": "stop-first"
        },
        "EndpointSpec": {
            "Mode": "vip",
            "Ports": [
                {
                    "Protocol": "tcp",
                    "TargetPort": 80,
                    "PublishedPort": 3001,
                    "PublishMode": "ingress"
                },
                {
                    "Protocol": "udp",
                    "TargetPort": 8125,
                    "PublishedPort": 8127,
                    "PublishMode": "ingress"
                }
            ]
        }
    }
}
```

this is from our compose file:

```
  graphite:
    image: graphite/graphite:snapshot-200604-190008-0588
    ports:
      - "3001:80"
      - "8127:8125/udp"
    deploy:
      placement:
        constraints: [node.labels.graphite == true]
    environment:
      - REDIS_TAGDB=true
    volumes:
      - "/var/lib/graphite/storage/whisper:/opt/graphite/storage/whisper"
```

**Comment by deniszh** [comment]
Hi @nikobearrr ,

Sorry, please use `docker stat` on container to check container limits and status, like
```
CONTAINER ID        NAME                CPU %               MEM USAGE / LIMIT     MEM %               NET I/O             BLOCK I/O           PIDS
22b85fc53092        graphite            0.52%               134.9MiB / 5.811GiB   2.27%               1.59kB / 0B         0B / 0B             41
```
15K/s is around 1M/minute which is not huge, but can be quite challenging for single carbon process (and by default it's only single process)

**Comment by nikobearrr** [comment]
I am currently running 1.1.6-2 and I will let it run for some time. 

```
CONTAINER ID        NAME                                                                           CPU %               MEM USAGE / LIMIT     MEM %               NET I/O             BLOCK I/O           PIDS
9b7c599aae6b        graphite_graphite.1.cynufttc4g00jrh2z1p82k66h                                144.07%             904.1MiB / 30.88GiB   2.86%               345MB / 79.7MB      2.35GB / 1.94GB     61
```

This is how it looks at the moment. I have reduced the metrics to send 2.5K metrics/s

**Comment by deniszh** [comment]
@nikobearrr : for log rotate patch you mean https://github.com/graphite-project/docker-graphite-statsd/issues/111#issuecomment-609960514 ?
I can backport it to 1.1.5 branch, if it helps.

**Comment by nikobearrr** [comment]
I will import those graphs to make it easier to observe how data looks. So far I have been running it for couple of hours with 1.1.6-2 and I can see on several times missing a point or two, but I give that to aggregation. I will let it run for some more hours, I will also run 1.1.7-2 again and I will get back to you with the test results on my findings.

@deniszh yes, the logrotation doesn't work on 1.1.5-3 - we figured out that when /var/lib/docker started getting full. Thank you for your suggestion, perhaps that could be the "quick" fix for us. However, I am still willing to dig in deeper to find if there is anything wrong with 1.1.7 or if our setup is not good enough.

Are there any guides on how much metrics/stats per second graphite can receive on some hardware? I expect that is not a straight forward number per CPU/per memory given different aggregation levels and so on. However, if you have some approximate idea/calculations?

**Comment by deniszh** [comment]
@nikobearrr : 
>yes, the logrotation doesn't work on 1.1.5-3 - we figured out that when /var/lib/docker started getting full. 

I just baked 1.1.5-14 with backported fix #111, you can try that. I can backport it to 1.1.6 too.

> Are there any guides on how much metrics/stats per second graphite can receive on some hardware? I expect that is not a straight forward number per CPU/per memory given different aggregation levels and so on. However, if you have some approximate idea/calculations?

Unfortunately, it's really hard to say, depends on so many variables.

I also created https://github.com/graphite-project/docker-graphite-statsd/issues/135 to look up for simplyfying scaling process.

BTW, theoretically, you can use something like [carbon-relay-ng](https://github.com/grafana/carbon-relay-ng) to split metric flow into 2 separate graphite installations and test new version w/o removing old one.

**Comment by nikobearrr** [comment]
Hey @deniszh, I think you have linked the wrong PR #111? Because the one you linked is from graphite-web 2012 saying "(WIP) Make divisors configurable". I will give it a go for a temporary resolution until I can find what is wrong with 1.1.7-2 in our setup. Thank you for your work.

I will look into carbon-relay-ng

**Comment by deniszh** [comment]
Yep, I mean 111 in docker repo - https://github.com/graphite-project/docker-graphite-statsd/issues/111
Let me know if I you find something

**Comment by nikobearrr** [comment]
I will share some of the initial things I have observed.
The setup: 
- I have been running graphite 1.1.6-2 and 1.1.7-2
- Metrics are generated by software which doesn't change (you can see same pattern in data)
- We track **data1** and **data2**
- data1 is "dynamic" value, data2 is always reported 0 (in the images I have set scale(1000) on it so it can be easily seen compared to just being on the bottom of the axis)
- The metrics for data1 and data2 are send together with the same timestamp
- The only difference between the docker images is I have changed the version. No changes in the docker image different than that, no changes in the deployment, no changes in carbon/graphite config.

This is how graphite 1.1.6-2 looked when I have ran it for a couple of hours. We can see some metrics are seen and there are some gaps. Only in specific times it has been that more than 1 point is missing. 

Image 1: 
![graphite 1 1 6-2 last 3h](https://user-images.githubusercontent.com/8693064/83922086-cfb38780-a790-11ea-8c77-f76583137fee.png)


This is an example of when more gaps appear when using 1.1.6-2

Image 2:
![graphite 1 1 6-2 bad period 01](https://user-images.githubusercontent.com/8693064/83922324-2e790100-a791-11ea-81af-360d4770312a.png)


graphite 1.1.6-2 ran for about 6-7 hours and I didn't observe major drops. Then I decided to switch to 1.1.7-2

After putting 1.1.7-2 and starting to feed it with metrics, the first thing to observe is that the stats from carbon are completely different. The carbon ops are not reported as before, but instead are combined(?) and the cpu usage is only shown every time the other metrics are reported.

Image 3:
![graphite 1 1 6-2 vs 1 1 7-2](https://user-images.githubusercontent.com/8693064/83922469-62ecbd00-a791-11ea-9c8f-d9cedddc672c.png)


After running the 1.1.7-2 for some time I could notice the same issue which I have seen before with missing some more data points. On 3 separate occassions I have observed missing points:

Image 4:
![graphite 1 1 7-2 bad period 01](https://user-images.githubusercontent.com/8693064/83922601-a6dfc200-a791-11ea-8eac-69a6d5d2b8ae.png)


I have also taken the server statistics from around the same time to see if something has changed:

Image 5: server cpu
![server cpu](https://user-images.githubusercontent.com/8693064/83922823-16ee4800-a792-
11ea-8159-6e44433768f7.png)

Image 6: server memory 
![server memory](https://user-images.githubusercontent.com/8693064/83922821-1655b180-a792-11ea-95da-300d54d8b2d1.png)

Image 7: container stats
![container stats](https://user-images.githubusercontent.com/8693064/83922810-1190fd80-a792-11ea-904c-43f3d65bfad5.png)


Here is what `docker stats` showed on the startup of the container and now, after running it for some hours:

```
start:
4f808d8dab2d        monitoring_graphite.1.bmrt4eyune5apbig5p4giwxrl                                19.72%              244MiB / 30.88GiB     0.77%               24.7MB / 4.99MB     307MB / 148MB       61

after 3h
4f808d8dab2d        monitoring_graphite.1.bmrt4eyune5apbig5p4giwxrl                                60.47%              240.9MiB / 30.88GiB   0.76%               236MB / 43.3MB      334MB / 1.36GB      61
```

I will continue to run 1.1.7-2 and keep you updated on it

**Comment by nikobearrr** [comment]
I got interested in how each version performs and whilst I can see 1.1.7-2 performs not-so-good for us, I started digging into how much data we send because the 2.5k metrics/s looks a bit high. I disabled most of the metrics we sent to this graphite and did a tcpdump.

First of all, this is picture of `1.1.7-2` vs `1.1.5-3`. I let 1.1.7-2 run over night and switched to 1.1.5-3 for further testing. You can see on the image on 1.1.7-2 we had much more gaps compared to how much we have on 1.1.5-3 (on both data being send).

Image 9: 
<img width="1843" alt="graphite 1 1 5-3 vs 1 1 7-2" src="https://user-images.githubusercontent.com/8693064/83941511-09ba7300-a7fd-11ea-95e4-fd85b9d98813.png">


2.5k metrics/s looked a bit high to me given what I think we send so I started disabling metrics. I left just a couple to see what graphite reports and I did a tcp dump. This is how the data looks. From the picture you can see we have on avg 330 metrics/s (20k metrics/minute), running on the same specced machine mentioned above.

Image 10:
![graphite 1 1 5-3 less data](https://user-images.githubusercontent.com/8693064/83941541-45edd380-a7fd-11ea-96a8-a782768f8e5a.png)


```1d5e903168a1        monitoring_graphite.1.os7met9gjczii3np5i9iwrqkj                     61.32%              265.4MiB / 30.88GiB   0.84%               220MB / 54.9MB      1.24GB / 1.6GB      69```

This is how `docker stats` loks for graphite while it's reporting 330 metrics/s

However, this number look too high for me. I don't believe it's 330 metrics/s. We only export port 8127/udp and there is nothing in the stack which sends to it. The stack consists of grafana (7.0.1) and graphite (1.1.5-3). I dont' see grafana sending any metrics.  So I did a tcpdump for about 1000 packets received on the host on port 8127. The command I have used is `tcpdump udp and port 8127`. 

As you can see in the export below, no more than 20 metrics/s are received. I have manually split them for each second so we can more easily observe how many we have/s. From 13:40:10 to 13:42:14 (approx 2 minutes) we have received 1068 packets, or around 550 metrics/minute, roughly 10/s. As you can see from the image below, it reports that we have received 330/s during that time. And we can still see "empty" points.

Image 11:
![graphite 1 1 5-3 during tcpdump](https://user-images.githubusercontent.com/8693064/83941687-594d6e80-a7fe-11ea-9a28-1703ba2a8584.png)

tcpdump:

```
root@host:~$ sudo tcpdump udp and port 8127
tcpdump: verbose output suppressed, use -v or -vv for full protocol decode
listening on bond0, link-type EN10MB (Ethernet), capture size 262144 bytes
13:40:10.305307 IP serverfrom.39823 > serverto.8127: UDP, length 29
13:40:10.305328 IP serverfrom.39823 > serverto.8127: UDP, length 29
13:40:10.305729 IP serverfrom.39823 > serverto.8127: UDP, length 40

13:40:11.306709 IP serverfrom.39823 > serverto.8127: UDP, length 29
13:40:11.306743 IP serverfrom.39823 > serverto.8127: UDP, length 29
13:40:11.306846 IP serverfrom.39823 > serverto.8127: UDP, length 40

13:40:12.308130 IP serverfrom.39823 > serverto.8127: UDP, length 29
13:40:12.308156 IP serverfrom.39823 > serverto.8127: UDP, length 29
13:40:12.308162 IP serverfrom.39823 > serverto.8127: UDP, length 40

13:40:13.003216 IP serverfrom.57671 > serverto.8127: UDP, length 37
13:40:13.003256 IP serverfrom.57671 > serverto.8127: UDP, length 40
13:40:13.003260 IP serverfrom.57671 > serverto.8127: UDP, length 39
13:40:13.003263 IP serverfrom.57671 > serverto.8127: UDP, length 37
13:40:13.003266 IP serverfrom.57671 > serverto.8127: UDP, length 36
13:40:13.003344 IP serverfrom.57671 > serverto.8127: UDP, length 36
13:40:13.309606 IP serverfrom.39823 > serverto.8127: UDP, length 29
13:40:13.309751 IP serverfrom.39823 > serverto.8127: UDP, length 29
13:40:13.309761 IP serverfrom.39823 > serverto.8127: UDP, length 40
13:40:13.801954 IP serverfrom.60197 > serverto.8127: UDP, length 35
13:40:13.802001 IP serverfrom.60197 > serverto.8127: UDP, length 40
13:40:13.802006 IP serverfrom.60197 > serverto.8127: UDP, length 41
13:40:13.802011 IP serverfrom.60197 > serverto.8127: UDP, length 37
13:40:13.802016 IP serverfrom.60197 > serverto.8127: UDP, length 44
13:40:13.802021 IP serverfrom.60197 > serverto.8127: UDP, length 46
13:40:13.802025 IP serverfrom.60197 > serverto.8127: UDP, length 46
13:40:13.881143 IP serverfrom.37307 > serverto.8127: UDP, length 36
13:40:13.881193 IP serverfrom.37307 > serverto.8127: UDP, length 40
13:40:13.881198 IP serverfrom.37307 > serverto.8127: UDP, length 41
13:40:13.881203 IP serverfrom.37307 > serverto.8127: UDP, length 37
13:40:13.881207 IP serverfrom.37307 > serverto.8127: UDP, length 44
13:40:13.881211 IP serverfrom.37307 > serverto.8127: UDP, length 46
13:40:13.881217 IP serverfrom.37307 > serverto.8127: UDP, length 46

13:40:14.346219 IP serverfrom.39823 > serverto.8127: UDP, length 28
13:40:14.346257 IP serverfrom.39823 > serverto.8127: UDP, length 28
13:40:14.346261 IP serverfrom.39823 > serverto.8127: UDP, length 40

13:40:15.363020 IP serverfrom.39823 > serverto.8127: UDP, length 28
13:40:15.363072 IP serverfrom.39823 > serverto.8127: UDP, length 28
13:40:15.363148 IP serverfrom.39823 > serverto.8127: UDP, length 40

13:40:16.364200 IP serverfrom.39823 > serverto.8127: UDP, length 28
13:40:16.364238 IP serverfrom.39823 > serverto.8127: UDP, length 28
13:40:16.364304 IP serverfrom.39823 > serverto.8127: UDP, length 40

13:40:17.366151 IP serverfrom.39823 > serverto.8127: UDP, length 28
13:40:17.366184 IP serverfrom.39823 > serverto.8127: UDP, length 28
13:40:17.366283 IP serverfrom.39823 > serverto.8127: UDP, length 40

13:40:18.009742 IP serverfrom.57671 > serverto.8127: UDP, length 37
13:40:18.009773 IP serverfrom.57671 > serverto.8127: UDP, length 40
13:40:18.009777 IP serverfrom.57671 > serverto.8127: UDP, length 39
13:40:18.009781 IP serverfrom.57671 > serverto.8127: UDP, length 37
13:40:18.009922 IP serverfrom.57671 > serverto.8127: UDP, length 36
13:40:18.009932 IP serverfrom.57671 > serverto.8127: UDP, length 36
13:40:18.368125 IP serverfrom.39823 > serverto.8127: UDP, length 28
13:40:18.368147 IP serverfrom.39823 > serverto.8127: UDP, length 28
13:40:18.368256 IP serverfrom.39823 > serverto.8127: UDP, length 40
13:40:18.851370 IP serverfrom.60197 > serverto.8127: UDP, length 36
13:40:18.851415 IP serverfrom.60197 > serverto.8127: UDP, length 40
13:40:18.851425 IP serverfrom.60197 > serverto.8127: UDP, length 41
13:40:18.851434 IP serverfrom.60197 > serverto.8127: UDP, length 37
13:40:18.851443 IP serverfrom.60197 > serverto.8127: UDP, length 44
13:40:18.851451 IP serverfrom.60197 > serverto.8127: UDP, length 46
13:40:18.851460 IP serverfrom.60197 > serverto.8127: UDP, length 46
13:40:18.926701 IP serverfrom.37307 > serverto.8127: UDP, length 36
13:40:18.926742 IP serverfrom.37307 > serverto.8127: UDP, length 40
13:40:18.926752 IP serverfrom.37307 > serverto.8127: UDP, length 41
13:40:18.926761 IP serverfrom.37307 > serverto.8127: UDP, length 37
13:40:18.926770 IP serverfrom.37307 > serverto.8127: UDP, length 44
13:40:18.926779 IP serverfrom.37307 > serverto.8127: UDP, length 46
13:40:18.926788 IP serverfrom.37307 > serverto.8127: UDP, length 46

13:40:19.370043 IP serverfrom.39823 > serverto.8127: UDP, length 28
13:40:19.370088 IP serverfrom.39823 > serverto.8127: UDP, length 28
13:40:19.370099 IP serverfrom.39823 > serverto.8127: UDP, length 40

13:40:20.372026 IP serverfrom.39823 > serverto.8127: UDP, length 28
13:40:20.372046 IP serverfrom.39823 > serverto.8127: UDP, length 28
13:40:20.372150 IP serverfrom.39823 > serverto.8127: UDP, length 40

13:40:21.374000 IP serverfrom.39823 > serverto.8127: UDP, length 28
13:40:21.374045 IP serverfrom.39823 > serverto.8127: UDP, length 28
13:40:21.374165 IP serverfrom.39823 > serverto.8127: UDP, length 40

13:40:22.375929 IP serverfrom.39823 > serverto.8127: UDP, length 28
13:40:22.375967 IP serverfrom.39823 > serverto.8127: UDP, length 28
13:40:22.375978 IP serverfrom.39823 > serverto.8127: UDP, length 40

13:40:23.013980 IP serverfrom.57671 > serverto.8127: UDP, length 37
13:40:23.014030 IP serverfrom.57671 > serverto.8127: UDP, length 40
13:40:23.014041 IP serverfrom.57671 > serverto.8127: UDP, length 39
13:40:23.014050 IP serverfrom.57671 > serverto.8127: UDP, length 37
13:40:23.014059 IP serverfrom.57671 > serverto.8127: UDP, length 36
13:40:23.014067 IP serverfrom.57671 > serverto.8127: UDP, length 36
13:40:23.377974 IP serverfrom.39823 > serverto.8127: UDP, length 28
13:40:23.378022 IP serverfrom.39823 > serverto.8127: UDP, length 28
13:40:23.378033 IP serverfrom.39823 > serverto.8127: UDP, length 40
13:40:23.860374 IP serverfrom.60197 > serverto.8127: UDP, length 36
13:40:23.860422 IP serverfrom.60197 > serverto.8127: UDP, length 40
13:40:23.860432 IP serverfrom.60197 > serverto.8127: UDP, length 41
13:40:23.860441 IP serverfrom.60197 > serverto.8127: UDP, length 37
13:40:23.860450 IP serverfrom.60197 > serverto.8127: UDP, length 44
13:40:23.860460 IP serverfrom.60197 > serverto.8127: UDP, length 46
13:40:23.860469 IP serverfrom.60197 > serverto.8127: UDP, length 46
13:40:23.935715 IP serverfrom.37307 > serverto.8127: UDP, length 35
13:40:23.935758 IP serverfrom.37307 > serverto.8127: UDP, length 40
13:40:23.935768 IP serverfrom.37307 > serverto.8127: UDP, length 41
13:40:23.935777 IP serverfrom.37307 > serverto.8127: UDP, length 37
13:40:23.935786 IP serverfrom.37307 > serverto.8127: UDP, length 44
13:40:23.935795 IP serverfrom.37307 > serverto.8127: UDP, length 46
13:40:23.935804 IP serverfrom.37307 > serverto.8127: UDP, length 46

13:40:24.379919 IP serverfrom.39823 > serverto.8127: UDP, length 29
13:40:24.379961 IP serverfrom.39823 > serverto.8127: UDP, length 29
13:40:24.379972 IP serverfrom.39823 > serverto.8127: UDP, length 40

13:40:25.381886 IP serverfrom.39823 > serverto.8127: UDP, length 29
13:40:25.381929 IP serverfrom.39823 > serverto.8127: UDP, length 29
13:40:25.382044 IP serverfrom.39823 > serverto.8127: UDP, length 40

13:40:26.383812 IP serverfrom.39823 > serverto.8127: UDP, length 29
13:40:26.383864 IP serverfrom.39823 > serverto.8127: UDP, length 29
13:40:26.383876 IP serverfrom.39823 > serverto.8127: UDP, length 40

13:40:27.385678 IP serverfrom.39823 > serverto.8127: UDP, length 29
13:40:27.385722 IP serverfrom.39823 > serverto.8127: UDP, length 29
13:40:27.385733 IP serverfrom.39823 > serverto.8127: UDP, length 40

13:40:28.023266 IP serverfrom.57671 > serverto.8127: UDP, length 37
13:40:28.023303 IP serverfrom.57671 > serverto.8127: UDP, length 40
13:40:28.023307 IP serverfrom.57671 > serverto.8127: UDP, length 39
13:40:28.023310 IP serverfrom.57671 > serverto.8127: UDP, length 37
13:40:28.023312 IP serverfrom.57671 > serverto.8127: UDP, length 36
13:40:28.023315 IP serverfrom.57671 > serverto.8127: UDP, length 36
13:40:28.387542 IP serverfrom.39823 > serverto.8127: UDP, length 29
13:40:28.387574 IP serverfrom.39823 > serverto.8127: UDP, length 29
13:40:28.387677 IP serverfrom.39823 > serverto.8127: UDP, length 40
13:40:28.869394 IP serverfrom.60197 > serverto.8127: UDP, length 35
13:40:28.869430 IP serverfrom.60197 > serverto.8127: UDP, length 40
13:40:28.869436 IP serverfrom.60197 > serverto.8127: UDP, length 41
13:40:28.869440 IP serverfrom.60197 > serverto.8127: UDP, length 37
13:40:28.869446 IP serverfrom.60197 > serverto.8127: UDP, length 44
13:40:28.869450 IP serverfrom.60197 > serverto.8127: UDP, length 46
13:40:28.869455 IP serverfrom.60197 > serverto.8127: UDP, length 46
13:40:28.869717 IP serverfrom.60197 > serverto.8127: UDP, length 36
13:40:28.869727 IP serverfrom.60197 > serverto.8127: UDP, length 39
13:40:28.869732 IP serverfrom.60197 > serverto.8127: UDP, length 36
13:40:28.869736 IP serverfrom.60197 > serverto.8127: UDP, length 44
13:40:28.944662 IP serverfrom.37307 > serverto.8127: UDP, length 35
13:40:28.944708 IP serverfrom.37307 > serverto.8127: UDP, length 40
13:40:28.944712 IP serverfrom.37307 > serverto.8127: UDP, length 41
13:40:28.944786 IP serverfrom.37307 > serverto.8127: UDP, length 37
13:40:28.944794 IP serverfrom.37307 > serverto.8127: UDP, length 44
13:40:28.944798 IP serverfrom.37307 > serverto.8127: UDP, length 46
13:40:28.944801 IP serverfrom.37307 > serverto.8127: UDP, length 46
13:40:28.944804 IP serverfrom.37307 > serverto.8127: UDP, length 43
13:40:28.944807 IP serverfrom.37307 > serverto.8127: UDP, length 42
13:40:28.944810 IP serverfrom.37307 > serverto.8127: UDP, length 49
13:40:28.944819 IP serverfrom.37307 > serverto.8127: UDP, length 45
13:40:28.944825 IP serverfrom.37307 > serverto.8127: UDP, length 39
13:40:28.944830 IP serverfrom.37307 > serverto.8127: UDP, length 44

13:40:29.389559 IP serverfrom.39823 > serverto.8127: UDP, length 29
13:40:29.389592 IP serverfrom.39823 > serverto.8127: UDP, length 29
13:40:29.389598 IP serverfrom.39823 > serverto.8127: UDP, length 40

13:40:30.391035 IP serverfrom.39823 > serverto.8127: UDP, length 29
13:40:30.391120 IP serverfrom.39823 > serverto.8127: UDP, length 29
13:40:30.391130 IP serverfrom.39823 > serverto.8127: UDP, length 40

13:40:31.392979 IP serverfrom.39823 > serverto.8127: UDP, length 29
13:40:31.393012 IP serverfrom.39823 > serverto.8127: UDP, length 29
13:40:31.393071 IP serverfrom.39823 > serverto.8127: UDP, length 40

13:40:32.394939 IP serverfrom.39823 > serverto.8127: UDP, length 29
13:40:32.394975 IP serverfrom.39823 > serverto.8127: UDP, length 29
13:40:32.394979 IP serverfrom.39823 > serverto.8127: UDP, length 40

13:40:33.032505 IP serverfrom.57671 > serverto.8127: UDP, length 37
13:40:33.032579 IP serverfrom.57671 > serverto.8127: UDP, length 40
13:40:33.032586 IP serverfrom.57671 > serverto.8127: UDP, length 39
13:40:33.032590 IP serverfrom.57671 > serverto.8127: UDP, length 37
13:40:33.032594 IP serverfrom.57671 > serverto.8127: UDP, length 36
13:40:33.032597 IP serverfrom.57671 > serverto.8127: UDP, length 36
13:40:33.396947 IP serverfrom.39823 > serverto.8127: UDP, length 29
13:40:33.396987 IP serverfrom.39823 > serverto.8127: UDP, length 29
13:40:33.397064 IP serverfrom.39823 > serverto.8127: UDP, length 40
13:40:33.876569 IP serverfrom.60197 > serverto.8127: UDP, length 35
13:40:33.876597 IP serverfrom.60197 > serverto.8127: UDP, length 40
13:40:33.876600 IP serverfrom.60197 > serverto.8127: UDP, length 41
13:40:33.876603 IP serverfrom.60197 > serverto.8127: UDP, length 37
13:40:33.876605 IP serverfrom.60197 > serverto.8127: UDP, length 44
13:40:33.876608 IP serverfrom.60197 > serverto.8127: UDP, length 46
13:40:33.876610 IP serverfrom.60197 > serverto.8127: UDP, length 46
13:40:33.953288 IP serverfrom.37307 > serverto.8127: UDP, length 36
13:40:33.953339 IP serverfrom.37307 > serverto.8127: UDP, length 40
13:40:33.953350 IP serverfrom.37307 > serverto.8127: UDP, length 41
13:40:33.953359 IP serverfrom.37307 > serverto.8127: UDP, length 37
13:40:33.953368 IP serverfrom.37307 > serverto.8127: UDP, length 44
13:40:33.953377 IP serverfrom.37307 > serverto.8127: UDP, length 46
13:40:33.953385 IP serverfrom.37307 > serverto.8127: UDP, length 46

13:40:34.399045 IP serverfrom.39823 > serverto.8127: UDP, length 29
13:40:34.399080 IP serverfrom.39823 > serverto.8127: UDP, length 29
13:40:34.399190 IP serverfrom.39823 > serverto.8127: UDP, length 40

13:40:35.401069 IP serverfrom.39823 > serverto.8127: UDP, length 29
13:40:35.401184 IP serverfrom.39823 > serverto.8127: UDP, length 29
13:40:35.401197 IP serverfrom.39823 > serverto.8127: UDP, length 40

13:40:36.403123 IP serverfrom.39823 > serverto.8127: UDP, length 29
13:40:36.403169 IP serverfrom.39823 > serverto.8127: UDP, length 29
13:40:36.403312 IP serverfrom.39823 > serverto.8127: UDP, length 40

13:40:37.405162 IP serverfrom.39823 > serverto.8127: UDP, length 29
13:40:37.405212 IP serverfrom.39823 > serverto.8127: UDP, length 29
13:40:37.405222 IP serverfrom.39823 > serverto.8127: UDP, length 40
13:40:38.040028 IP serverfrom.57671 > serverto.8127: UDP, length 37
13:40:38.040076 IP serverfrom.57671 > serverto.8127: UDP, length 40
13:40:38.040086 IP serverfrom.57671 > serverto.8127: UDP, length 39
13:40:38.040096 IP serverfrom.57671 > serverto.8127: UDP, length 37
13:40:38.040105 IP serverfrom.57671 > serverto.8127: UDP, length 36
13:40:38.040114 IP serverfrom.57671 > serverto.8127: UDP, length 36
13:40:38.407000 IP serverfrom.39823 > serverto.8127: UDP, length 29
13:40:38.407046 IP serverfrom.39823 > serverto.8127: UDP, length 29
13:40:38.407056 IP serverfrom.39823 > serverto.8127: UDP, length 40
13:40:38.885483 IP serverfrom.60197 > serverto.8127: UDP, length 36
13:40:38.885531 IP serverfrom.60197 > serverto.8127: UDP, length 40
13:40:38.885541 IP serverfrom.60197 > serverto.8127: UDP, length 41
13:40:38.885551 IP serverfrom.60197 > serverto.8127: UDP, length 37
13:40:38.885559 IP serverfrom.60197 > serverto.8127: UDP, length 44
13:40:38.885570 IP serverfrom.60197 > serverto.8127: UDP, length 46
13:40:38.885579 IP serverfrom.60197 > serverto.8127: UDP, length 46
13:40:38.885928 IP serverfrom.60197 > serverto.8127: UDP, length 49
13:40:38.885936 IP serverfrom.60197 > serverto.8127: UDP, length 44
13:40:38.885939 IP serverfrom.60197 > serverto.8127: UDP, length 43
13:40:38.885942 IP serverfrom.60197 > serverto.8127: UDP, length 45
13:40:38.885944 IP serverfrom.60197 > serverto.8127: UDP, length 36
13:40:38.885947 IP serverfrom.60197 > serverto.8127: UDP, length 39
13:40:38.885949 IP serverfrom.60197 > serverto.8127: UDP, length 36
13:40:38.962194 IP serverfrom.37307 > serverto.8127: UDP, length 36
13:40:38.962236 IP serverfrom.37307 > serverto.8127: UDP, length 40
13:40:38.962247 IP serverfrom.37307 > serverto.8127: UDP, length 41
13:40:38.962256 IP serverfrom.37307 > serverto.8127: UDP, length 37
13:40:38.962266 IP serverfrom.37307 > serverto.8127: UDP, length 44
13:40:38.962275 IP serverfrom.37307 > serverto.8127: UDP, length 46
13:40:38.962284 IP serverfrom.37307 > serverto.8127: UDP, length 46

13:40:39.409014 IP serverfrom.39823 > serverto.8127: UDP, length 29
13:40:39.409048 IP serverfrom.39823 > serverto.8127: UDP, length 29
13:40:39.409149 IP serverfrom.39823 > serverto.8127: UDP, length 40

13:40:40.411051 IP serverfrom.39823 > serverto.8127: UDP, length 29
13:40:40.411075 IP serverfrom.39823 > serverto.8127: UDP, length 29
13:40:40.411190 IP serverfrom.39823 > serverto.8127: UDP, length 40

13:40:41.413047 IP serverfrom.39823 > serverto.8127: UDP, length 29
13:40:41.413073 IP serverfrom.39823 > serverto.8127: UDP, length 29
13:40:41.413077 IP serverfrom.39823 > serverto.8127: UDP, length 40

13:40:42.414935 IP serverfrom.39823 > serverto.8127: UDP, length 29
13:40:42.414984 IP serverfrom.39823 > serverto.8127: UDP, length 29
13:40:42.414987 IP serverfrom.39823 > serverto.8127: UDP, length 40

13:40:43.050670 IP serverfrom.57671 > serverto.8127: UDP, length 37
13:40:43.050717 IP serverfrom.57671 > serverto.8127: UDP, length 40
13:40:43.050727 IP serverfrom.57671 > serverto.8127: UDP, length 39
13:40:43.050737 IP serverfrom.57671 > serverto.8127: UDP, length 37
13:40:43.050746 IP serverfrom.57671 > serverto.8127: UDP, length 36
13:40:43.050755 IP serverfrom.57671 > serverto.8127: UDP, length 36
13:40:43.416885 IP serverfrom.39823 > serverto.8127: UDP, length 29
13:40:43.417001 IP serverfrom.39823 > serverto.8127: UDP, length 29
13:40:43.417008 IP serverfrom.39823 > serverto.8127: UDP, length 40
13:40:43.892600 IP serverfrom.60197 > serverto.8127: UDP, length 36
13:40:43.892630 IP serverfrom.60197 > serverto.8127: UDP, length 40
13:40:43.892707 IP serverfrom.60197 > serverto.8127: UDP, length 41
13:40:43.892719 IP serverfrom.60197 > serverto.8127: UDP, length 37
13:40:43.892723 IP serverfrom.60197 > serverto.8127: UDP, length 44
13:40:43.892728 IP serverfrom.60197 > serverto.8127: UDP, length 46
13:40:43.892731 IP serverfrom.60197 > serverto.8127: UDP, length 46
13:40:43.892735 IP serverfrom.60197 > serverto.8127: UDP, length 43
13:40:43.892738 IP serverfrom.60197 > serverto.8127: UDP, length 43
13:40:43.892846 IP serverfrom.60197 > serverto.8127: UDP, length 39
13:40:43.892853 IP serverfrom.60197 > serverto.8127: UDP, length 36
13:40:43.892857 IP serverfrom.60197 > serverto.8127: UDP, length 44
13:40:43.971074 IP serverfrom.37307 > serverto.8127: UDP, length 36
13:40:43.971112 IP serverfrom.37307 > serverto.8127: UDP, length 40
13:40:43.971116 IP serverfrom.37307 > serverto.8127: UDP, length 41
13:40:43.971119 IP serverfrom.37307 > serverto.8127: UDP, length 37
13:40:43.971122 IP serverfrom.37307 > serverto.8127: UDP, length 44
13:40:43.971125 IP serverfrom.37307 > serverto.8127: UDP, length 46
13:40:43.971128 IP serverfrom.37307 > serverto.8127: UDP, length 46
13:40:43.971305 IP serverfrom.37307 > serverto.8127: UDP, length 42
13:40:43.971313 IP serverfrom.37307 > serverto.8127: UDP, length 49
13:40:43.971316 IP serverfrom.37307 > serverto.8127: UDP, length 44
13:40:43.971320 IP serverfrom.37307 > serverto.8127: UDP, length 43
13:40:43.971323 IP serverfrom.37307 > serverto.8127: UDP, length 45
13:40:43.971326 IP serverfrom.37307 > serverto.8127: UDP, length 36
13:40:43.971329 IP serverfrom.37307 > serverto.8127: UDP, length 39

13:40:44.418925 IP serverfrom.39823 > serverto.8127: UDP, length 29
13:40:44.418971 IP serverfrom.39823 > serverto.8127: UDP, length 29
13:40:44.418977 IP serverfrom.39823 > serverto.8127: UDP, length 40

13:40:45.420834 IP serverfrom.39823 > serverto.8127: UDP, length 29
13:40:45.420876 IP serverfrom.39823 > serverto.8127: UDP, length 29
13:40:45.421010 IP serverfrom.39823 > serverto.8127: UDP, length 40

13:40:46.422868 IP serverfrom.39823 > serverto.8127: UDP, length 29
13:40:46.422911 IP serverfrom.39823 > serverto.8127: UDP, length 29
13:40:46.422993 IP serverfrom.39823 > serverto.8127: UDP, length 40

13:40:47.424929 IP serverfrom.39823 > serverto.8127: UDP, length 29
13:40:47.424972 IP serverfrom.39823 > serverto.8127: UDP, length 29
13:40:47.425058 IP serverfrom.39823 > serverto.8127: UDP, length 40

13:40:48.061172 IP serverfrom.57671 > serverto.8127: UDP, length 37
13:40:48.061208 IP serverfrom.57671 > serverto.8127: UDP, length 40
13:40:48.061213 IP serverfrom.57671 > serverto.8127: UDP, length 39
13:40:48.061216 IP serverfrom.57671 > serverto.8127: UDP, length 37
13:40:48.061219 IP serverfrom.57671 > serverto.8127: UDP, length 36
13:40:48.061353 IP serverfrom.57671 > serverto.8127: UDP, length 36
13:40:48.426978 IP serverfrom.39823 > serverto.8127: UDP, length 29
13:40:48.427083 IP serverfrom.39823 > serverto.8127: UDP, length 29
13:40:48.427091 IP serverfrom.39823 > serverto.8127: UDP, length 40
13:40:48.899906 IP serverfrom.60197 > serverto.8127: UDP, length 36
13:40:48.899929 IP serverfrom.60197 > serverto.8127: UDP, length 40
13:40:48.899933 IP serverfrom.60197 > serverto.8127: UDP, length 41
13:40:48.899936 IP serverfrom.60197 > serverto.8127: UDP, length 37
13:40:48.899939 IP serverfrom.60197 > serverto.8127: UDP, length 44
13:40:48.899942 IP serverfrom.60197 > serverto.8127: UDP, length 46
13:40:48.899945 IP serverfrom.60197 > serverto.8127: UDP, length 46
13:40:48.980119 IP serverfrom.37307 > serverto.8127: UDP, length 35
13:40:48.980157 IP serverfrom.37307 > serverto.8127: UDP, length 40
13:40:48.980161 IP serverfrom.37307 > serverto.8127: UDP, length 41
13:40:48.980164 IP serverfrom.37307 > serverto.8127: UDP, length 37
13:40:48.980166 IP serverfrom.37307 > serverto.8127: UDP, length 44
13:40:48.980169 IP serverfrom.37307 > serverto.8127: UDP, length 46
13:40:48.980172 IP serverfrom.37307 > serverto.8127: UDP, length 46

13:40:49.429053 IP serverfrom.39823 > serverto.8127: UDP, length 29
13:40:49.429097 IP serverfrom.39823 > serverto.8127: UDP, length 29
13:40:49.429292 IP serverfrom.39823 > serverto.8127: UDP, length 40

13:40:50.431165 IP serverfrom.39823 > serverto.8127: UDP, length 29
13:40:50.431216 IP serverfrom.39823 > serverto.8127: UDP, length 29
13:40:50.431220 IP serverfrom.39823 > serverto.8127: UDP, length 40

13:40:51.433129 IP serverfrom.39823 > serverto.8127: UDP, length 29
13:40:51.433191 IP serverfrom.39823 > serverto.8127: UDP, length 29
13:40:51.433198 IP serverfrom.39823 > serverto.8127: UDP, length 40

13:40:52.435085 IP serverfrom.39823 > serverto.8127: UDP, length 29
13:40:52.435137 IP serverfrom.39823 > serverto.8127: UDP, length 29
13:40:52.435141 IP serverfrom.39823 > serverto.8127: UDP, length 40

13:40:53.070520 IP serverfrom.57671 > serverto.8127: UDP, length 37
13:40:53.070553 IP serverfrom.57671 > serverto.8127: UDP, length 40
13:40:53.070558 IP serverfrom.57671 > serverto.8127: UDP, length 39
13:40:53.070560 IP serverfrom.57671 > serverto.8127: UDP, length 37
13:40:53.070563 IP serverfrom.57671 > serverto.8127: UDP, length 36
13:40:53.070566 IP serverfrom.57671 > serverto.8127: UDP, length 36
13:40:53.437146 IP serverfrom.39823 > serverto.8127: UDP, length 29
13:40:53.437190 IP serverfrom.39823 > serverto.8127: UDP, length 29
13:40:53.437200 IP serverfrom.39823 > serverto.8127: UDP, length 40
13:40:53.908976 IP serverfrom.60197 > serverto.8127: UDP, length 35
13:40:53.909017 IP serverfrom.60197 > serverto.8127: UDP, length 40
13:40:53.909205 IP serverfrom.60197 > serverto.8127: UDP, length 41
13:40:53.909220 IP serverfrom.60197 > serverto.8127: UDP, length 37
13:40:53.909229 IP serverfrom.60197 > serverto.8127: UDP, length 44
13:40:53.909238 IP serverfrom.60197 > serverto.8127: UDP, length 46
13:40:53.909247 IP serverfrom.60197 > serverto.8127: UDP, length 46
13:40:53.909255 IP serverfrom.60197 > serverto.8127: UDP, length 43
13:40:53.909264 IP serverfrom.60197 > serverto.8127: UDP, length 43
13:40:53.909333 IP serverfrom.60197 > serverto.8127: UDP, length 36
13:40:53.989064 IP serverfrom.37307 > serverto.8127: UDP, length 35
13:40:53.989084 IP serverfrom.37307 > serverto.8127: UDP, length 40
13:40:53.989087 IP serverfrom.37307 > serverto.8127: UDP, length 41
13:40:53.989182 IP serverfrom.37307 > serverto.8127: UDP, length 37
13:40:53.989188 IP serverfrom.37307 > serverto.8127: UDP, length 44
13:40:53.989190 IP serverfrom.37307 > serverto.8127: UDP, length 46
13:40:53.989193 IP serverfrom.37307 > serverto.8127: UDP, length 46
13:40:53.989196 IP serverfrom.37307 > serverto.8127: UDP, length 43
13:40:53.989199 IP serverfrom.37307 > serverto.8127: UDP, length 42
13:40:53.989201 IP serverfrom.37307 > serverto.8127: UDP, length 49

13:40:54.439167 IP serverfrom.39823 > serverto.8127: UDP, length 29
13:40:54.439214 IP serverfrom.39823 > serverto.8127: UDP, length 29
13:40:54.439224 IP serverfrom.39823 > serverto.8127: UDP, length 40

13:40:55.441091 IP serverfrom.39823 > serverto.8127: UDP, length 29
13:40:55.441132 IP serverfrom.39823 > serverto.8127: UDP, length 29
13:40:55.441143 IP serverfrom.39823 > serverto.8127: UDP, length 40

13:40:56.443049 IP serverfrom.39823 > serverto.8127: UDP, length 29
13:40:56.443093 IP serverfrom.39823 > serverto.8127: UDP, length 29
13:40:56.443104 IP serverfrom.39823 > serverto.8127: UDP, length 40

13:40:57.445007 IP serverfrom.39823 > serverto.8127: UDP, length 29
13:40:57.445061 IP serverfrom.39823 > serverto.8127: UDP, length 29
13:40:57.445072 IP serverfrom.39823 > serverto.8127: UDP, length 40

13:40:58.081109 IP serverfrom.57671 > serverto.8127: UDP, length 37
13:40:58.081219 IP serverfrom.57671 > serverto.8127: UDP, length 40
13:40:58.081226 IP serverfrom.57671 > serverto.8127: UDP, length 39
13:40:58.081230 IP serverfrom.57671 > serverto.8127: UDP, length 37
13:40:58.081233 IP serverfrom.57671 > serverto.8127: UDP, length 36
13:40:58.081236 IP serverfrom.57671 > serverto.8127: UDP, length 36
13:40:58.446909 IP serverfrom.39823 > serverto.8127: UDP, length 29
13:40:58.446961 IP serverfrom.39823 > serverto.8127: UDP, length 29
13:40:58.446972 IP serverfrom.39823 > serverto.8127: UDP, length 40
13:40:58.915641 IP serverfrom.60197 > serverto.8127: UDP, length 35
13:40:58.915673 IP serverfrom.60197 > serverto.8127: UDP, length 40
13:40:58.915677 IP serverfrom.60197 > serverto.8127: UDP, length 41
13:40:58.915681 IP serverfrom.60197 > serverto.8127: UDP, length 37
13:40:58.915684 IP serverfrom.60197 > serverto.8127: UDP, length 44
13:40:58.915687 IP serverfrom.60197 > serverto.8127: UDP, length 46
13:40:58.915840 IP serverfrom.60197 > serverto.8127: UDP, length 46
13:40:58.915847 IP serverfrom.60197 > serverto.8127: UDP, length 43
13:40:58.915850 IP serverfrom.60197 > serverto.8127: UDP, length 43
13:40:58.915853 IP serverfrom.60197 > serverto.8127: UDP, length 49
13:40:58.915857 IP serverfrom.60197 > serverto.8127: UDP, length 44
13:40:58.915860 IP serverfrom.60197 > serverto.8127: UDP, length 43
13:40:58.915863 IP serverfrom.60197 > serverto.8127: UDP, length 45
13:40:58.995672 IP serverfrom.37307 > serverto.8127: UDP, length 36
13:40:58.995707 IP serverfrom.37307 > serverto.8127: UDP, length 40
13:40:58.995712 IP serverfrom.37307 > serverto.8127: UDP, length 41
13:40:58.995715 IP serverfrom.37307 > serverto.8127: UDP, length 37
13:40:58.995719 IP serverfrom.37307 > serverto.8127: UDP, length 44
13:40:58.995722 IP serverfrom.37307 > serverto.8127: UDP, length 46
13:40:58.995725 IP serverfrom.37307 > serverto.8127: UDP, length 46
13:40:58.995812 IP serverfrom.37307 > serverto.8127: UDP, length 43
13:40:58.995819 IP serverfrom.37307 > serverto.8127: UDP, length 42
13:40:58.995823 IP serverfrom.37307 > serverto.8127: UDP, length 49
13:40:58.995826 IP serverfrom.37307 > serverto.8127: UDP, length 44
13:40:58.995829 IP serverfrom.37307 > serverto.8127: UDP, length 43
13:40:58.995831 IP serverfrom.37307 > serverto.8127: UDP, length 45
13:40:58.995834 IP serverfrom.37307 > serverto.8127: UDP, length 36
13:40:58.995843 IP serverfrom.37307 > serverto.8127: UDP, length 44

13:40:59.448919 IP serverfrom.39823 > serverto.8127: UDP, length 29
13:40:59.449075 IP serverfrom.39823 > serverto.8127: UDP, length 29
13:40:59.449087 IP serverfrom.39823 > serverto.8127: UDP, length 40

13:41:00.451040 IP serverfrom.39823 > serverto.8127: UDP, length 29
13:41:00.451080 IP serverfrom.39823 > serverto.8127: UDP, length 29
13:41:00.451084 IP serverfrom.39823 > serverto.8127: UDP, length 40

13:41:01.453025 IP serverfrom.39823 > serverto.8127: UDP, length 29
13:41:01.453138 IP serverfrom.39823 > serverto.8127: UDP, length 29
13:41:01.453147 IP serverfrom.39823 > serverto.8127: UDP, length 40

13:41:02.454548 IP serverfrom.39823 > serverto.8127: UDP, length 29
13:41:02.454583 IP serverfrom.39823 > serverto.8127: UDP, length 29
13:41:02.454587 IP serverfrom.39823 > serverto.8127: UDP, length 40

13:41:03.089259 IP serverfrom.57671 > serverto.8127: UDP, length 37
13:41:03.089360 IP serverfrom.57671 > serverto.8127: UDP, length 40
13:41:03.089366 IP serverfrom.57671 > serverto.8127: UDP, length 39
13:41:03.089371 IP serverfrom.57671 > serverto.8127: UDP, length 37
13:41:03.089375 IP serverfrom.57671 > serverto.8127: UDP, length 36
13:41:03.089379 IP serverfrom.57671 > serverto.8127: UDP, length 36
13:41:03.456459 IP serverfrom.39823 > serverto.8127: UDP, length 29
13:41:03.456504 IP serverfrom.39823 > serverto.8127: UDP, length 29
13:41:03.456508 IP serverfrom.39823 > serverto.8127: UDP, length 40
13:41:03.924628 IP serverfrom.60197 > serverto.8127: UDP, length 36
13:41:03.924664 IP serverfrom.60197 > serverto.8127: UDP, length 40
13:41:03.924668 IP serverfrom.60197 > serverto.8127: UDP, length 41
13:41:03.924671 IP serverfrom.60197 > serverto.8127: UDP, length 37
13:41:03.924674 IP serverfrom.60197 > serverto.8127: UDP, length 44
13:41:03.924677 IP serverfrom.60197 > serverto.8127: UDP, length 46
13:41:03.924680 IP serverfrom.60197 > serverto.8127: UDP, length 46

13:41:04.004556 IP serverfrom.37307 > serverto.8127: UDP, length 36
13:41:04.004604 IP serverfrom.37307 > serverto.8127: UDP, length 40
13:41:04.004614 IP serverfrom.37307 > serverto.8127: UDP, length 41
13:41:04.004623 IP serverfrom.37307 > serverto.8127: UDP, length 37
13:41:04.004633 IP serverfrom.37307 > serverto.8127: UDP, length 44
13:41:04.004641 IP serverfrom.37307 > serverto.8127: UDP, length 46
13:41:04.004650 IP serverfrom.37307 > serverto.8127: UDP, length 46
13:41:04.458421 IP serverfrom.39823 > serverto.8127: UDP, length 29
13:41:04.458445 IP serverfrom.39823 > serverto.8127: UDP, length 29
13:41:04.458449 IP serverfrom.39823 > serverto.8127: UDP, length 40

13:41:05.460373 IP serverfrom.39823 > serverto.8127: UDP, length 29
13:41:05.460442 IP serverfrom.39823 > serverto.8127: UDP, length 29
13:41:05.460465 IP serverfrom.39823 > serverto.8127: UDP, length 40

13:41:06.462363 IP serverfrom.39823 > serverto.8127: UDP, length 29
13:41:06.462472 IP serverfrom.39823 > serverto.8127: UDP, length 29
13:41:06.462480 IP serverfrom.39823 > serverto.8127: UDP, length 40

13:41:07.464401 IP serverfrom.39823 > serverto.8127: UDP, length 29
13:41:07.464437 IP serverfrom.39823 > serverto.8127: UDP, length 29
13:41:07.464492 IP serverfrom.39823 > serverto.8127: UDP, length 40

13:41:08.098603 IP serverfrom.57671 > serverto.8127: UDP, length 37
13:41:08.098651 IP serverfrom.57671 > serverto.8127: UDP, length 40
13:41:08.098661 IP serverfrom.57671 > serverto.8127: UDP, length 39
13:41:08.098671 IP serverfrom.57671 > serverto.8127: UDP, length 37
13:41:08.098679 IP serverfrom.57671 > serverto.8127: UDP, length 36
13:41:08.098687 IP serverfrom.57671 > serverto.8127: UDP, length 36
13:41:08.466347 IP serverfrom.39823 > serverto.8127: UDP, length 29
13:41:08.466373 IP serverfrom.39823 > serverto.8127: UDP, length 29
13:41:08.466377 IP serverfrom.39823 > serverto.8127: UDP, length 40
13:41:08.929476 IP serverfrom.60197 > serverto.8127: UDP, length 36
13:41:08.929517 IP serverfrom.60197 > serverto.8127: UDP, length 40
13:41:08.929528 IP serverfrom.60197 > serverto.8127: UDP, length 41
13:41:08.929717 IP serverfrom.60197 > serverto.8127: UDP, length 37
13:41:08.929725 IP serverfrom.60197 > serverto.8127: UDP, length 44
13:41:08.929728 IP serverfrom.60197 > serverto.8127: UDP, length 46
13:41:08.929731 IP serverfrom.60197 > serverto.8127: UDP, length 46
13:41:08.929734 IP serverfrom.60197 > serverto.8127: UDP, length 43
13:41:08.929736 IP serverfrom.60197 > serverto.8127: UDP, length 43
13:41:08.929739 IP serverfrom.60197 > serverto.8127: UDP, length 49

13:41:09.013580 IP serverfrom.37307 > serverto.8127: UDP, length 35
13:41:09.013623 IP serverfrom.37307 > serverto.8127: UDP, length 40
13:41:09.013633 IP serverfrom.37307 > serverto.8127: UDP, length 41
13:41:09.013642 IP serverfrom.37307 > serverto.8127: UDP, length 37
13:41:09.013651 IP serverfrom.37307 > serverto.8127: UDP, length 44
13:41:09.013659 IP serverfrom.37307 > serverto.8127: UDP, length 46
13:41:09.013668 IP serverfrom.37307 > serverto.8127: UDP, length 46
13:41:09.468318 IP serverfrom.39823 > serverto.8127: UDP, length 29
13:41:09.468361 IP serverfrom.39823 > serverto.8127: UDP, length 29
13:41:09.468372 IP serverfrom.39823 > serverto.8127: UDP, length 40

13:41:10.470281 IP serverfrom.39823 > serverto.8127: UDP, length 29
13:41:10.470394 IP serverfrom.39823 > serverto.8127: UDP, length 29
13:41:10.470402 IP serverfrom.39823 > serverto.8127: UDP, length 40

13:41:11.472371 IP serverfrom.39823 > serverto.8127: UDP, length 29
13:41:11.472505 IP serverfrom.39823 > serverto.8127: UDP, length 29
13:41:11.472519 IP serverfrom.39823 > serverto.8127: UDP, length 40

13:41:12.474471 IP serverfrom.39823 > serverto.8127: UDP, length 29
13:41:12.474514 IP serverfrom.39823 > serverto.8127: UDP, length 29
13:41:12.474524 IP serverfrom.39823 > serverto.8127: UDP, length 40

13:41:13.108032 IP serverfrom.57671 > serverto.8127: UDP, length 37
13:41:13.108066 IP serverfrom.57671 > serverto.8127: UDP, length 40
13:41:13.108070 IP serverfrom.57671 > serverto.8127: UDP, length 39
13:41:13.108074 IP serverfrom.57671 > serverto.8127: UDP, length 37
13:41:13.108077 IP serverfrom.57671 > serverto.8127: UDP, length 36
13:41:13.108081 IP serverfrom.57671 > serverto.8127: UDP, length 36
13:41:13.476482 IP serverfrom.39823 > serverto.8127: UDP, length 29
13:41:13.476637 IP serverfrom.39823 > serverto.8127: UDP, length 29
13:41:13.476646 IP serverfrom.39823 > serverto.8127: UDP, length 40
13:41:13.941173 IP serverfrom.60197 > serverto.8127: UDP, length 35
13:41:13.941214 IP serverfrom.60197 > serverto.8127: UDP, length 40
13:41:13.941274 IP serverfrom.60197 > serverto.8127: UDP, length 41
13:41:13.941279 IP serverfrom.60197 > serverto.8127: UDP, length 37
13:41:13.941282 IP serverfrom.60197 > serverto.8127: UDP, length 44
13:41:13.941285 IP serverfrom.60197 > serverto.8127: UDP, length 46
13:41:13.941288 IP serverfrom.60197 > serverto.8127: UDP, length 46
13:41:13.941320 IP serverfrom.60197 > serverto.8127: UDP, length 43
13:41:13.941325 IP serverfrom.60197 > serverto.8127: UDP, length 43
13:41:13.941328 IP serverfrom.60197 > serverto.8127: UDP, length 49
13:41:13.941331 IP serverfrom.60197 > serverto.8127: UDP, length 44
13:41:13.941333 IP serverfrom.60197 > serverto.8127: UDP, length 43
13:41:13.941336 IP serverfrom.60197 > serverto.8127: UDP, length 45
13:41:13.941339 IP serverfrom.60197 > serverto.8127: UDP, length 36
13:41:13.941343 IP serverfrom.60197 > serverto.8127: UDP, length 39
13:41:13.941346 IP serverfrom.60197 > serverto.8127: UDP, length 36
13:41:13.941349 IP serverfrom.60197 > serverto.8127: UDP, length 44

13:41:14.026855 IP serverfrom.37307 > serverto.8127: UDP, length 35
13:41:14.026892 IP serverfrom.37307 > serverto.8127: UDP, length 40
13:41:14.026950 IP serverfrom.37307 > serverto.8127: UDP, length 41
13:41:14.026957 IP serverfrom.37307 > serverto.8127: UDP, length 37
13:41:14.026975 IP serverfrom.37307 > serverto.8127: UDP, length 44
13:41:14.026999 IP serverfrom.37307 > serverto.8127: UDP, length 46
13:41:14.027054 IP serverfrom.37307 > serverto.8127: UDP, length 46
13:41:14.027082 IP serverfrom.37307 > serverto.8127: UDP, length 43
13:41:14.027088 IP serverfrom.37307 > serverto.8127: UDP, length 42
13:41:14.027093 IP serverfrom.37307 > serverto.8127: UDP, length 49
13:41:14.027097 IP serverfrom.37307 > serverto.8127: UDP, length 44
13:41:14.027101 IP serverfrom.37307 > serverto.8127: UDP, length 43
13:41:14.027105 IP serverfrom.37307 > serverto.8127: UDP, length 45
13:41:14.027111 IP serverfrom.37307 > serverto.8127: UDP, length 36
13:41:14.027115 IP serverfrom.37307 > serverto.8127: UDP, length 39
13:41:14.027119 IP serverfrom.37307 > serverto.8127: UDP, length 40
13:41:14.027197 IP serverfrom.37307 > serverto.8127: UDP, length 44
13:41:14.489022 IP serverfrom.39823 > serverto.8127: UDP, length 28
13:41:14.489067 IP serverfrom.39823 > serverto.8127: UDP, length 28
13:41:14.489071 IP serverfrom.39823 > serverto.8127: UDP, length 41

13:41:15.492800 IP serverfrom.39823 > serverto.8127: UDP, length 28
13:41:15.492944 IP serverfrom.39823 > serverto.8127: UDP, length 28
13:41:15.492957 IP serverfrom.39823 > serverto.8127: UDP, length 41

13:41:16.494942 IP serverfrom.39823 > serverto.8127: UDP, length 28
13:41:16.495024 IP serverfrom.39823 > serverto.8127: UDP, length 28
13:41:16.495045 IP serverfrom.39823 > serverto.8127: UDP, length 41

13:41:17.496458 IP serverfrom.39823 > serverto.8127: UDP, length 28
13:41:17.496502 IP serverfrom.39823 > serverto.8127: UDP, length 28
13:41:17.496511 IP serverfrom.39823 > serverto.8127: UDP, length 41

13:41:18.117361 IP serverfrom.57671 > serverto.8127: UDP, length 37
13:41:18.117392 IP serverfrom.57671 > serverto.8127: UDP, length 40
13:41:18.117396 IP serverfrom.57671 > serverto.8127: UDP, length 39
13:41:18.117399 IP serverfrom.57671 > serverto.8127: UDP, length 37
13:41:18.117402 IP serverfrom.57671 > serverto.8127: UDP, length 36
13:41:18.117536 IP serverfrom.57671 > serverto.8127: UDP, length 36
13:41:18.498482 IP serverfrom.39823 > serverto.8127: UDP, length 28
13:41:18.498534 IP serverfrom.39823 > serverto.8127: UDP, length 28
13:41:18.498554 IP serverfrom.39823 > serverto.8127: UDP, length 41
13:41:18.960197 IP serverfrom.60197 > serverto.8127: UDP, length 35
13:41:18.960244 IP serverfrom.60197 > serverto.8127: UDP, length 40
13:41:18.960255 IP serverfrom.60197 > serverto.8127: UDP, length 41
13:41:18.960265 IP serverfrom.60197 > serverto.8127: UDP, length 37
13:41:18.960274 IP serverfrom.60197 > serverto.8127: UDP, length 44
13:41:18.960283 IP serverfrom.60197 > serverto.8127: UDP, length 46
13:41:18.960292 IP serverfrom.60197 > serverto.8127: UDP, length 46

13:41:19.044946 IP serverfrom.37307 > serverto.8127: UDP, length 36
13:41:19.044991 IP serverfrom.37307 > serverto.8127: UDP, length 40
13:41:19.045183 IP serverfrom.37307 > serverto.8127: UDP, length 41
13:41:19.045202 IP serverfrom.37307 > serverto.8127: UDP, length 37
13:41:19.045211 IP serverfrom.37307 > serverto.8127: UDP, length 44
13:41:19.045219 IP serverfrom.37307 > serverto.8127: UDP, length 46
13:41:19.045229 IP serverfrom.37307 > serverto.8127: UDP, length 46
13:41:19.045237 IP serverfrom.37307 > serverto.8127: UDP, length 43
13:41:19.045245 IP serverfrom.37307 > serverto.8127: UDP, length 42
13:41:19.045254 IP serverfrom.37307 > serverto.8127: UDP, length 49
13:41:19.045262 IP serverfrom.37307 > serverto.8127: UDP, length 44
13:41:19.045279 IP serverfrom.37307 > serverto.8127: UDP, length 45
13:41:19.045287 IP serverfrom.37307 > serverto.8127: UDP, length 36
13:41:19.045303 IP serverfrom.37307 > serverto.8127: UDP, length 40
13:41:19.045311 IP serverfrom.37307 > serverto.8127: UDP, length 44
13:41:19.500498 IP serverfrom.39823 > serverto.8127: UDP, length 28
13:41:19.500548 IP serverfrom.39823 > serverto.8127: UDP, length 28
13:41:19.500561 IP serverfrom.39823 > serverto.8127: UDP, length 41

13:41:20.502584 IP serverfrom.39823 > serverto.8127: UDP, length 28
13:41:20.502699 IP serverfrom.39823 > serverto.8127: UDP, length 28
13:41:20.502708 IP serverfrom.39823 > serverto.8127: UDP, length 41

13:41:21.504629 IP serverfrom.39823 > serverto.8127: UDP, length 28
13:41:21.504657 IP serverfrom.39823 > serverto.8127: UDP, length 28
13:41:21.504661 IP serverfrom.39823 > serverto.8127: UDP, length 41

13:41:22.506720 IP serverfrom.39823 > serverto.8127: UDP, length 28
13:41:22.506856 IP serverfrom.39823 > serverto.8127: UDP, length 28
13:41:22.506871 IP serverfrom.39823 > serverto.8127: UDP, length 41

13:41:23.126769 IP serverfrom.57671 > serverto.8127: UDP, length 37
13:41:23.126818 IP serverfrom.57671 > serverto.8127: UDP, length 40
13:41:23.126829 IP serverfrom.57671 > serverto.8127: UDP, length 39
13:41:23.126839 IP serverfrom.57671 > serverto.8127: UDP, length 37
13:41:23.126848 IP serverfrom.57671 > serverto.8127: UDP, length 36
13:41:23.126866 IP serverfrom.57671 > serverto.8127: UDP, length 36
13:41:23.508860 IP serverfrom.39823 > serverto.8127: UDP, length 28
13:41:23.508884 IP serverfrom.39823 > serverto.8127: UDP, length 28
13:41:23.508980 IP serverfrom.39823 > serverto.8127: UDP, length 41
13:41:23.969453 IP serverfrom.60197 > serverto.8127: UDP, length 36
13:41:23.969501 IP serverfrom.60197 > serverto.8127: UDP, length 40
13:41:23.969513 IP serverfrom.60197 > serverto.8127: UDP, length 41
13:41:23.969522 IP serverfrom.60197 > serverto.8127: UDP, length 37
13:41:23.969532 IP serverfrom.60197 > serverto.8127: UDP, length 44
13:41:23.969541 IP serverfrom.60197 > serverto.8127: UDP, length 46
13:41:23.969550 IP serverfrom.60197 > serverto.8127: UDP, length 46

13:41:24.054487 IP serverfrom.37307 > serverto.8127: UDP, length 36
13:41:24.054529 IP serverfrom.37307 > serverto.8127: UDP, length 40
13:41:24.054539 IP serverfrom.37307 > serverto.8127: UDP, length 41
13:41:24.054548 IP serverfrom.37307 > serverto.8127: UDP, length 37
13:41:24.054685 IP serverfrom.37307 > serverto.8127: UDP, length 44
13:41:24.054693 IP serverfrom.37307 > serverto.8127: UDP, length 46
13:41:24.054696 IP serverfrom.37307 > serverto.8127: UDP, length 46
13:41:24.054698 IP serverfrom.37307 > serverto.8127: UDP, length 43
13:41:24.054701 IP serverfrom.37307 > serverto.8127: UDP, length 42
13:41:24.054703 IP serverfrom.37307 > serverto.8127: UDP, length 49
13:41:24.054706 IP serverfrom.37307 > serverto.8127: UDP, length 44
13:41:24.054711 IP serverfrom.37307 > serverto.8127: UDP, length 45
13:41:24.054714 IP serverfrom.37307 > serverto.8127: UDP, length 36
13:41:24.054716 IP serverfrom.37307 > serverto.8127: UDP, length 39
13:41:24.054719 IP serverfrom.37307 > serverto.8127: UDP, length 40
13:41:24.054722 IP serverfrom.37307 > serverto.8127: UDP, length 44
13:41:24.510888 IP serverfrom.39823 > serverto.8127: UDP, length 29
13:41:24.510918 IP serverfrom.39823 > serverto.8127: UDP, length 29
13:41:24.510923 IP serverfrom.39823 > serverto.8127: UDP, length 41

13:41:25.512909 IP serverfrom.39823 > serverto.8127: UDP, length 29
13:41:25.512948 IP serverfrom.39823 > serverto.8127: UDP, length 29
13:41:25.512959 IP serverfrom.39823 > serverto.8127: UDP, length 41

13:41:26.514875 IP serverfrom.39823 > serverto.8127: UDP, length 29
13:41:26.514906 IP serverfrom.39823 > serverto.8127: UDP, length 29
13:41:26.514911 IP serverfrom.39823 > serverto.8127: UDP, length 41

13:41:27.516887 IP serverfrom.39823 > serverto.8127: UDP, length 29
13:41:27.516920 IP serverfrom.39823 > serverto.8127: UDP, length 29
13:41:27.516925 IP serverfrom.39823 > serverto.8127: UDP, length 41

13:41:28.135285 IP serverfrom.57671 > serverto.8127: UDP, length 37
13:41:28.135320 IP serverfrom.57671 > serverto.8127: UDP, length 40
13:41:28.135324 IP serverfrom.57671 > serverto.8127: UDP, length 39
13:41:28.135327 IP serverfrom.57671 > serverto.8127: UDP, length 37
13:41:28.135331 IP serverfrom.57671 > serverto.8127: UDP, length 36
13:41:28.135467 IP serverfrom.57671 > serverto.8127: UDP, length 36
13:41:28.518857 IP serverfrom.39823 > serverto.8127: UDP, length 29
13:41:28.518889 IP serverfrom.39823 > serverto.8127: UDP, length 29
13:41:28.518893 IP serverfrom.39823 > serverto.8127: UDP, length 41
13:41:28.978808 IP serverfrom.60197 > serverto.8127: UDP, length 36
13:41:28.978862 IP serverfrom.60197 > serverto.8127: UDP, length 40
13:41:28.978869 IP serverfrom.60197 > serverto.8127: UDP, length 41
13:41:28.978874 IP serverfrom.60197 > serverto.8127: UDP, length 37
13:41:28.978879 IP serverfrom.60197 > serverto.8127: UDP, length 44
13:41:28.978885 IP serverfrom.60197 > serverto.8127: UDP, length 46
13:41:28.978890 IP serverfrom.60197 > serverto.8127: UDP, length 46

13:41:29.064102 IP serverfrom.37307 > serverto.8127: UDP, length 35
13:41:29.064149 IP serverfrom.37307 > serverto.8127: UDP, length 40
13:41:29.064224 IP serverfrom.37307 > serverto.8127: UDP, length 41
13:41:29.064232 IP serverfrom.37307 > serverto.8127: UDP, length 37
13:41:29.064237 IP serverfrom.37307 > serverto.8127: UDP, length 44
13:41:29.064269 IP serverfrom.37307 > serverto.8127: UDP, length 46
13:41:29.064276 IP serverfrom.37307 > serverto.8127: UDP, length 46
13:41:29.064298 IP serverfrom.37307 > serverto.8127: UDP, length 43
13:41:29.064304 IP serverfrom.37307 > serverto.8127: UDP, length 42
13:41:29.064324 IP serverfrom.37307 > serverto.8127: UDP, length 49
13:41:29.064331 IP serverfrom.37307 > serverto.8127: UDP, length 44
13:41:29.064336 IP serverfrom.37307 > serverto.8127: UDP, length 43
13:41:29.064339 IP serverfrom.37307 > serverto.8127: UDP, length 45
13:41:29.064344 IP serverfrom.37307 > serverto.8127: UDP, length 36
13:41:29.064348 IP serverfrom.37307 > serverto.8127: UDP, length 39
13:41:29.064352 IP serverfrom.37307 > serverto.8127: UDP, length 40
13:41:29.064356 IP serverfrom.37307 > serverto.8127: UDP, length 44
13:41:29.520950 IP serverfrom.39823 > serverto.8127: UDP, length 29
13:41:29.521093 IP serverfrom.39823 > serverto.8127: UDP, length 29
13:41:29.521103 IP serverfrom.39823 > serverto.8127: UDP, length 41

13:41:30.523041 IP serverfrom.39823 > serverto.8127: UDP, length 29
13:41:30.523146 IP serverfrom.39823 > serverto.8127: UDP, length 29
13:41:30.523155 IP serverfrom.39823 > serverto.8127: UDP, length 41

13:41:31.525127 IP serverfrom.39823 > serverto.8127: UDP, length 29
13:41:31.525162 IP serverfrom.39823 > serverto.8127: UDP, length 29
13:41:31.525167 IP serverfrom.39823 > serverto.8127: UDP, length 41

13:41:32.527076 IP serverfrom.39823 > serverto.8127: UDP, length 29
13:41:32.527121 IP serverfrom.39823 > serverto.8127: UDP, length 29
13:41:32.527124 IP serverfrom.39823 > serverto.8127: UDP, length 41

13:41:33.143411 IP serverfrom.57671 > serverto.8127: UDP, length 37
13:41:33.143432 IP serverfrom.57671 > serverto.8127: UDP, length 40
13:41:33.143436 IP serverfrom.57671 > serverto.8127: UDP, length 39
13:41:33.143501 IP serverfrom.57671 > serverto.8127: UDP, length 37
13:41:33.143509 IP serverfrom.57671 > serverto.8127: UDP, length 36
13:41:33.143513 IP serverfrom.57671 > serverto.8127: UDP, length 36
13:41:33.529088 IP serverfrom.39823 > serverto.8127: UDP, length 29
13:41:33.529113 IP serverfrom.39823 > serverto.8127: UDP, length 29
13:41:33.529226 IP serverfrom.39823 > serverto.8127: UDP, length 41
13:41:33.988210 IP serverfrom.60197 > serverto.8127: UDP, length 35
13:41:33.988261 IP serverfrom.60197 > serverto.8127: UDP, length 40
13:41:33.988265 IP serverfrom.60197 > serverto.8127: UDP, length 41
13:41:33.988268 IP serverfrom.60197 > serverto.8127: UDP, length 37
13:41:33.988270 IP serverfrom.60197 > serverto.8127: UDP, length 44
13:41:33.988273 IP serverfrom.60197 > serverto.8127: UDP, length 46
13:41:33.988276 IP serverfrom.60197 > serverto.8127: UDP, length 46
13:41:33.988491 IP serverfrom.60197 > serverto.8127: UDP, length 36
13:41:33.988500 IP serverfrom.60197 > serverto.8127: UDP, length 39
13:41:33.988504 IP serverfrom.60197 > serverto.8127: UDP, length 36
13:41:33.988507 IP serverfrom.60197 > serverto.8127: UDP, length 44

13:41:34.073582 IP serverfrom.37307 > serverto.8127: UDP, length 35
13:41:34.073624 IP serverfrom.37307 > serverto.8127: UDP, length 40
13:41:34.073811 IP serverfrom.37307 > serverto.8127: UDP, length 41
13:41:34.073828 IP serverfrom.37307 > serverto.8127: UDP, length 37
13:41:34.073840 IP serverfrom.37307 > serverto.8127: UDP, length 44
13:41:34.073852 IP serverfrom.37307 > serverto.8127: UDP, length 46
13:41:34.073866 IP serverfrom.37307 > serverto.8127: UDP, length 46
13:41:34.073876 IP serverfrom.37307 > serverto.8127: UDP, length 43
13:41:34.073885 IP serverfrom.37307 > serverto.8127: UDP, length 42
13:41:34.073893 IP serverfrom.37307 > serverto.8127: UDP, length 49
13:41:34.073901 IP serverfrom.37307 > serverto.8127: UDP, length 44
13:41:34.073909 IP serverfrom.37307 > serverto.8127: UDP, length 43
13:41:34.073917 IP serverfrom.37307 > serverto.8127: UDP, length 45
13:41:34.073934 IP serverfrom.37307 > serverto.8127: UDP, length 39
13:41:34.074050 IP serverfrom.37307 > serverto.8127: UDP, length 40
13:41:34.074054 IP serverfrom.37307 > serverto.8127: UDP, length 44
13:41:34.531080 IP serverfrom.39823 > serverto.8127: UDP, length 29
13:41:34.531129 IP serverfrom.39823 > serverto.8127: UDP, length 29
13:41:34.531140 IP serverfrom.39823 > serverto.8127: UDP, length 41

13:41:35.533079 IP serverfrom.39823 > serverto.8127: UDP, length 29
13:41:35.533100 IP serverfrom.39823 > serverto.8127: UDP, length 29
13:41:35.533195 IP serverfrom.39823 > serverto.8127: UDP, length 41

13:41:36.535141 IP serverfrom.39823 > serverto.8127: UDP, length 29
13:41:36.535249 IP serverfrom.39823 > serverto.8127: UDP, length 29
13:41:36.535257 IP serverfrom.39823 > serverto.8127: UDP, length 41

13:41:37.537250 IP serverfrom.39823 > serverto.8127: UDP, length 29
13:41:37.537282 IP serverfrom.39823 > serverto.8127: UDP, length 29
13:41:37.537342 IP serverfrom.39823 > serverto.8127: UDP, length 41

13:41:38.152709 IP serverfrom.57671 > serverto.8127: UDP, length 37
13:41:38.152753 IP serverfrom.57671 > serverto.8127: UDP, length 40
13:41:38.152763 IP serverfrom.57671 > serverto.8127: UDP, length 39
13:41:38.152772 IP serverfrom.57671 > serverto.8127: UDP, length 37
13:41:38.152781 IP serverfrom.57671 > serverto.8127: UDP, length 36
13:41:38.152790 IP serverfrom.57671 > serverto.8127: UDP, length 36
13:41:38.539323 IP serverfrom.39823 > serverto.8127: UDP, length 29
13:41:38.539372 IP serverfrom.39823 > serverto.8127: UDP, length 29
13:41:38.539383 IP serverfrom.39823 > serverto.8127: UDP, length 41
13:41:38.997570 IP serverfrom.60197 > serverto.8127: UDP, length 35
13:41:38.997614 IP serverfrom.60197 > serverto.8127: UDP, length 40
13:41:38.997624 IP serverfrom.60197 > serverto.8127: UDP, length 41
13:41:38.997633 IP serverfrom.60197 > serverto.8127: UDP, length 37
13:41:38.997644 IP serverfrom.60197 > serverto.8127: UDP, length 44
13:41:38.997653 IP serverfrom.60197 > serverto.8127: UDP, length 46
13:41:38.997662 IP serverfrom.60197 > serverto.8127: UDP, length 46

13:41:39.083197 IP serverfrom.37307 > serverto.8127: UDP, length 36
13:41:39.083214 IP serverfrom.37307 > serverto.8127: UDP, length 40
13:41:39.083218 IP serverfrom.37307 > serverto.8127: UDP, length 41
13:41:39.083220 IP serverfrom.37307 > serverto.8127: UDP, length 37
13:41:39.083223 IP serverfrom.37307 > serverto.8127: UDP, length 44
13:41:39.083226 IP serverfrom.37307 > serverto.8127: UDP, length 46
13:41:39.083276 IP serverfrom.37307 > serverto.8127: UDP, length 46
13:41:39.083279 IP serverfrom.37307 > serverto.8127: UDP, length 43
13:41:39.083282 IP serverfrom.37307 > serverto.8127: UDP, length 42
13:41:39.083284 IP serverfrom.37307 > serverto.8127: UDP, length 49
13:41:39.083303 IP serverfrom.37307 > serverto.8127: UDP, length 44
13:41:39.083306 IP serverfrom.37307 > serverto.8127: UDP, length 43
13:41:39.083309 IP serverfrom.37307 > serverto.8127: UDP, length 45
13:41:39.083312 IP serverfrom.37307 > serverto.8127: UDP, length 36
13:41:39.083315 IP serverfrom.37307 > serverto.8127: UDP, length 39
13:41:39.083318 IP serverfrom.37307 > serverto.8127: UDP, length 40
13:41:39.083320 IP serverfrom.37307 > serverto.8127: UDP, length 44
13:41:39.541345 IP serverfrom.39823 > serverto.8127: UDP, length 29
13:41:39.541380 IP serverfrom.39823 > serverto.8127: UDP, length 29
13:41:39.541383 IP serverfrom.39823 > serverto.8127: UDP, length 41

13:41:40.543326 IP serverfrom.39823 > serverto.8127: UDP, length 29
13:41:40.543349 IP serverfrom.39823 > serverto.8127: UDP, length 29
13:41:40.543437 IP serverfrom.39823 > serverto.8127: UDP, length 41

13:41:41.545303 IP serverfrom.39823 > serverto.8127: UDP, length 29
13:41:41.545326 IP serverfrom.39823 > serverto.8127: UDP, length 29
13:41:41.545424 IP serverfrom.39823 > serverto.8127: UDP, length 41

13:41:42.547414 IP serverfrom.39823 > serverto.8127: UDP, length 29
13:41:42.547513 IP serverfrom.39823 > serverto.8127: UDP, length 29
13:41:42.547538 IP serverfrom.39823 > serverto.8127: UDP, length 41

13:41:43.159918 IP serverfrom.57671 > serverto.8127: UDP, length 37
13:41:43.159950 IP serverfrom.57671 > serverto.8127: UDP, length 40
13:41:43.159954 IP serverfrom.57671 > serverto.8127: UDP, length 39
13:41:43.159957 IP serverfrom.57671 > serverto.8127: UDP, length 37
13:41:43.160090 IP serverfrom.57671 > serverto.8127: UDP, length 36
13:41:43.160097 IP serverfrom.57671 > serverto.8127: UDP, length 36
13:41:43.549568 IP serverfrom.39823 > serverto.8127: UDP, length 29
13:41:43.549662 IP serverfrom.39823 > serverto.8127: UDP, length 29
13:41:43.549668 IP serverfrom.39823 > serverto.8127: UDP, length 41

13:41:44.005598 IP serverfrom.60197 > serverto.8127: UDP, length 36
13:41:44.005647 IP serverfrom.60197 > serverto.8127: UDP, length 40
13:41:44.005651 IP serverfrom.60197 > serverto.8127: UDP, length 41
13:41:44.005655 IP serverfrom.60197 > serverto.8127: UDP, length 37
13:41:44.005658 IP serverfrom.60197 > serverto.8127: UDP, length 44
13:41:44.005661 IP serverfrom.60197 > serverto.8127: UDP, length 46
13:41:44.005664 IP serverfrom.60197 > serverto.8127: UDP, length 46
13:41:44.005667 IP serverfrom.60197 > serverto.8127: UDP, length 43
13:41:44.005670 IP serverfrom.60197 > serverto.8127: UDP, length 43
13:41:44.005676 IP serverfrom.60197 > serverto.8127: UDP, length 44
13:41:44.005680 IP serverfrom.60197 > serverto.8127: UDP, length 43
13:41:44.005683 IP serverfrom.60197 > serverto.8127: UDP, length 45
13:41:44.005686 IP serverfrom.60197 > serverto.8127: UDP, length 36
13:41:44.005692 IP serverfrom.60197 > serverto.8127: UDP, length 36
13:41:44.005695 IP serverfrom.60197 > serverto.8127: UDP, length 44
13:41:44.092376 IP serverfrom.37307 > serverto.8127: UDP, length 36
13:41:44.092415 IP serverfrom.37307 > serverto.8127: UDP, length 40
13:41:44.092532 IP serverfrom.37307 > serverto.8127: UDP, length 41
13:41:44.092540 IP serverfrom.37307 > serverto.8127: UDP, length 37
13:41:44.092544 IP serverfrom.37307 > serverto.8127: UDP, length 44
13:41:44.092547 IP serverfrom.37307 > serverto.8127: UDP, length 46
13:41:44.092551 IP serverfrom.37307 > serverto.8127: UDP, length 46
13:41:44.092554 IP serverfrom.37307 > serverto.8127: UDP, length 43
13:41:44.092557 IP serverfrom.37307 > serverto.8127: UDP, length 42
13:41:44.092569 IP serverfrom.37307 > serverto.8127: UDP, length 45
13:41:44.092576 IP serverfrom.37307 > serverto.8127: UDP, length 39
13:41:44.092580 IP serverfrom.37307 > serverto.8127: UDP, length 40
13:41:44.092583 IP serverfrom.37307 > serverto.8127: UDP, length 44
13:41:44.551735 IP serverfrom.39823 > serverto.8127: UDP, length 29
13:41:44.551904 IP serverfrom.39823 > serverto.8127: UDP, length 29
13:41:44.551917 IP serverfrom.39823 > serverto.8127: UDP, length 41

13:41:45.553887 IP serverfrom.39823 > serverto.8127: UDP, length 29
13:41:45.553925 IP serverfrom.39823 > serverto.8127: UDP, length 29
13:41:45.553929 IP serverfrom.39823 > serverto.8127: UDP, length 41

13:41:46.555903 IP serverfrom.39823 > serverto.8127: UDP, length 29
13:41:46.555955 IP serverfrom.39823 > serverto.8127: UDP, length 29
13:41:46.555961 IP serverfrom.39823 > serverto.8127: UDP, length 41

13:41:47.557990 IP serverfrom.39823 > serverto.8127: UDP, length 29
13:41:47.558100 IP serverfrom.39823 > serverto.8127: UDP, length 29
13:41:47.558109 IP serverfrom.39823 > serverto.8127: UDP, length 41

13:41:48.168559 IP serverfrom.57671 > serverto.8127: UDP, length 37
13:41:48.168586 IP serverfrom.57671 > serverto.8127: UDP, length 40
13:41:48.168683 IP serverfrom.57671 > serverto.8127: UDP, length 39
13:41:48.168695 IP serverfrom.57671 > serverto.8127: UDP, length 37
13:41:48.168699 IP serverfrom.57671 > serverto.8127: UDP, length 36
13:41:48.168703 IP serverfrom.57671 > serverto.8127: UDP, length 36
13:41:48.560047 IP serverfrom.39823 > serverto.8127: UDP, length 29
13:41:48.560070 IP serverfrom.39823 > serverto.8127: UDP, length 29
13:41:48.560177 IP serverfrom.39823 > serverto.8127: UDP, length 41

13:41:49.013628 IP serverfrom.60197 > serverto.8127: UDP, length 36
13:41:49.013687 IP serverfrom.60197 > serverto.8127: UDP, length 40
13:41:49.013692 IP serverfrom.60197 > serverto.8127: UDP, length 41
13:41:49.013695 IP serverfrom.60197 > serverto.8127: UDP, length 37
13:41:49.013699 IP serverfrom.60197 > serverto.8127: UDP, length 44
13:41:49.013702 IP serverfrom.60197 > serverto.8127: UDP, length 46
13:41:49.013838 IP serverfrom.60197 > serverto.8127: UDP, length 46
13:41:49.013847 IP serverfrom.60197 > serverto.8127: UDP, length 43
13:41:49.013850 IP serverfrom.60197 > serverto.8127: UDP, length 43
13:41:49.013854 IP serverfrom.60197 > serverto.8127: UDP, length 49
13:41:49.013857 IP serverfrom.60197 > serverto.8127: UDP, length 44
13:41:49.013860 IP serverfrom.60197 > serverto.8127: UDP, length 43
13:41:49.013863 IP serverfrom.60197 > serverto.8127: UDP, length 45
13:41:49.013866 IP serverfrom.60197 > serverto.8127: UDP, length 36
13:41:49.013873 IP serverfrom.60197 > serverto.8127: UDP, length 36
13:41:49.013934 IP serverfrom.60197 > serverto.8127: UDP, length 44
13:41:49.101903 IP serverfrom.37307 > serverto.8127: UDP, length 35
13:41:49.101983 IP serverfrom.37307 > serverto.8127: UDP, length 40
13:41:49.101996 IP serverfrom.37307 > serverto.8127: UDP, length 41
13:41:49.101999 IP serverfrom.37307 > serverto.8127: UDP, length 37
13:41:49.102047 IP serverfrom.37307 > serverto.8127: UDP, length 44
13:41:49.102060 IP serverfrom.37307 > serverto.8127: UDP, length 46
13:41:49.102082 IP serverfrom.37307 > serverto.8127: UDP, length 46
13:41:49.102112 IP serverfrom.37307 > serverto.8127: UDP, length 43
13:41:49.102117 IP serverfrom.37307 > serverto.8127: UDP, length 42
13:41:49.102134 IP serverfrom.37307 > serverto.8127: UDP, length 49
13:41:49.102139 IP serverfrom.37307 > serverto.8127: UDP, length 44
13:41:49.102142 IP serverfrom.37307 > serverto.8127: UDP, length 43
13:41:49.102146 IP serverfrom.37307 > serverto.8127: UDP, length 45
13:41:49.102150 IP serverfrom.37307 > serverto.8127: UDP, length 36
13:41:49.102154 IP serverfrom.37307 > serverto.8127: UDP, length 39
13:41:49.102194 IP serverfrom.37307 > serverto.8127: UDP, length 40
13:41:49.102198 IP serverfrom.37307 > serverto.8127: UDP, length 44
13:41:49.562030 IP serverfrom.39823 > serverto.8127: UDP, length 29
13:41:49.562063 IP serverfrom.39823 > serverto.8127: UDP, length 29
13:41:49.562067 IP serverfrom.39823 > serverto.8127: UDP, length 41

13:41:50.564052 IP serverfrom.39823 > serverto.8127: UDP, length 29
13:41:50.564097 IP serverfrom.39823 > serverto.8127: UDP, length 29
13:41:50.564108 IP serverfrom.39823 > serverto.8127: UDP, length 41

13:41:51.566023 IP serverfrom.39823 > serverto.8127: UDP, length 29
13:41:51.566044 IP serverfrom.39823 > serverto.8127: UDP, length 29
13:41:51.566048 IP serverfrom.39823 > serverto.8127: UDP, length 41

13:41:52.568047 IP serverfrom.39823 > serverto.8127: UDP, length 29
13:41:52.568069 IP serverfrom.39823 > serverto.8127: UDP, length 29
13:41:52.568072 IP serverfrom.39823 > serverto.8127: UDP, length 41

13:41:53.177326 IP serverfrom.57671 > serverto.8127: UDP, length 37
13:41:53.177376 IP serverfrom.57671 > serverto.8127: UDP, length 40
13:41:53.177389 IP serverfrom.57671 > serverto.8127: UDP, length 39
13:41:53.177398 IP serverfrom.57671 > serverto.8127: UDP, length 37
13:41:53.177407 IP serverfrom.57671 > serverto.8127: UDP, length 36
13:41:53.177416 IP serverfrom.57671 > serverto.8127: UDP, length 36
13:41:53.570042 IP serverfrom.39823 > serverto.8127: UDP, length 29
13:41:53.570067 IP serverfrom.39823 > serverto.8127: UDP, length 29
13:41:53.570071 IP serverfrom.39823 > serverto.8127: UDP, length 41

13:41:54.023317 IP serverfrom.60197 > serverto.8127: UDP, length 35
13:41:54.023362 IP serverfrom.60197 > serverto.8127: UDP, length 40
13:41:54.023373 IP serverfrom.60197 > serverto.8127: UDP, length 41
13:41:54.023382 IP serverfrom.60197 > serverto.8127: UDP, length 37
13:41:54.023391 IP serverfrom.60197 > serverto.8127: UDP, length 44
13:41:54.023401 IP serverfrom.60197 > serverto.8127: UDP, length 46
13:41:54.023410 IP serverfrom.60197 > serverto.8127: UDP, length 46
13:41:54.108503 IP serverfrom.37307 > serverto.8127: UDP, length 35
13:41:54.108541 IP serverfrom.37307 > serverto.8127: UDP, length 40
13:41:54.108552 IP serverfrom.37307 > serverto.8127: UDP, length 41
13:41:54.108561 IP serverfrom.37307 > serverto.8127: UDP, length 37
13:41:54.108572 IP serverfrom.37307 > serverto.8127: UDP, length 44
13:41:54.108580 IP serverfrom.37307 > serverto.8127: UDP, length 46
13:41:54.108589 IP serverfrom.37307 > serverto.8127: UDP, length 46
13:41:54.572087 IP serverfrom.39823 > serverto.8127: UDP, length 29
13:41:54.572112 IP serverfrom.39823 > serverto.8127: UDP, length 29
13:41:54.572117 IP serverfrom.39823 > serverto.8127: UDP, length 41

13:41:55.574136 IP serverfrom.39823 > serverto.8127: UDP, length 29
13:41:55.574257 IP serverfrom.39823 > serverto.8127: UDP, length 29
13:41:55.574269 IP serverfrom.39823 > serverto.8127: UDP, length 41

13:41:56.576288 IP serverfrom.39823 > serverto.8127: UDP, length 29
13:41:56.576333 IP serverfrom.39823 > serverto.8127: UDP, length 29
13:41:56.576451 IP serverfrom.39823 > serverto.8127: UDP, length 41

13:41:57.578478 IP serverfrom.39823 > serverto.8127: UDP, length 29
13:41:57.578533 IP serverfrom.39823 > serverto.8127: UDP, length 29
13:41:57.578549 IP serverfrom.39823 > serverto.8127: UDP, length 41

13:41:58.183484 IP serverfrom.57671 > serverto.8127: UDP, length 37
13:41:58.183520 IP serverfrom.57671 > serverto.8127: UDP, length 40
13:41:58.183526 IP serverfrom.57671 > serverto.8127: UDP, length 39
13:41:58.183530 IP serverfrom.57671 > serverto.8127: UDP, length 37
13:41:58.183533 IP serverfrom.57671 > serverto.8127: UDP, length 36
13:41:58.183540 IP serverfrom.57671 > serverto.8127: UDP, length 36
13:41:58.580447 IP serverfrom.39823 > serverto.8127: UDP, length 29
13:41:58.580475 IP serverfrom.39823 > serverto.8127: UDP, length 29
13:41:58.580480 IP serverfrom.39823 > serverto.8127: UDP, length 41

13:41:59.032696 IP serverfrom.60197 > serverto.8127: UDP, length 35
13:41:59.032744 IP serverfrom.60197 > serverto.8127: UDP, length 40
13:41:59.032751 IP serverfrom.60197 > serverto.8127: UDP, length 41
13:41:59.032843 IP serverfrom.60197 > serverto.8127: UDP, length 37
13:41:59.032851 IP serverfrom.60197 > serverto.8127: UDP, length 44
13:41:59.032857 IP serverfrom.60197 > serverto.8127: UDP, length 46
13:41:59.032861 IP serverfrom.60197 > serverto.8127: UDP, length 46
13:41:59.032866 IP serverfrom.60197 > serverto.8127: UDP, length 43
13:41:59.032870 IP serverfrom.60197 > serverto.8127: UDP, length 43
13:41:59.032874 IP serverfrom.60197 > serverto.8127: UDP, length 49
13:41:59.032878 IP serverfrom.60197 > serverto.8127: UDP, length 44
13:41:59.032882 IP serverfrom.60197 > serverto.8127: UDP, length 43
13:41:59.032887 IP serverfrom.60197 > serverto.8127: UDP, length 45
13:41:59.032891 IP serverfrom.60197 > serverto.8127: UDP, length 36
13:41:59.032895 IP serverfrom.60197 > serverto.8127: UDP, length 39
13:41:59.032899 IP serverfrom.60197 > serverto.8127: UDP, length 36
13:41:59.032904 IP serverfrom.60197 > serverto.8127: UDP, length 44
13:41:59.117815 IP serverfrom.37307 > serverto.8127: UDP, length 36
13:41:59.117856 IP serverfrom.37307 > serverto.8127: UDP, length 40
13:41:59.117859 IP serverfrom.37307 > serverto.8127: UDP, length 41
13:41:59.117863 IP serverfrom.37307 > serverto.8127: UDP, length 37
13:41:59.117866 IP serverfrom.37307 > serverto.8127: UDP, length 44
13:41:59.117870 IP serverfrom.37307 > serverto.8127: UDP, length 46
13:41:59.117873 IP serverfrom.37307 > serverto.8127: UDP, length 46
13:41:59.117876 IP serverfrom.37307 > serverto.8127: UDP, length 43
13:41:59.117889 IP serverfrom.37307 > serverto.8127: UDP, length 43
13:41:59.117897 IP serverfrom.37307 > serverto.8127: UDP, length 36
13:41:59.117901 IP serverfrom.37307 > serverto.8127: UDP, length 39
13:41:59.118045 IP serverfrom.37307 > serverto.8127: UDP, length 40
13:41:59.118052 IP serverfrom.37307 > serverto.8127: UDP, length 44
13:41:59.582449 IP serverfrom.39823 > serverto.8127: UDP, length 29
13:41:59.582486 IP serverfrom.39823 > serverto.8127: UDP, length 29
13:41:59.582492 IP serverfrom.39823 > serverto.8127: UDP, length 41

13:42:00.584457 IP serverfrom.39823 > serverto.8127: UDP, length 29
13:42:00.584562 IP serverfrom.39823 > serverto.8127: UDP, length 29
13:42:00.584570 IP serverfrom.39823 > serverto.8127: UDP, length 41

13:42:01.586479 IP serverfrom.39823 > serverto.8127: UDP, length 29
13:42:01.586509 IP serverfrom.39823 > serverto.8127: UDP, length 29
13:42:01.586636 IP serverfrom.39823 > serverto.8127: UDP, length 41

13:42:02.588498 IP serverfrom.39823 > serverto.8127: UDP, length 29
13:42:02.588540 IP serverfrom.39823 > serverto.8127: UDP, length 29
13:42:02.588615 IP serverfrom.39823 > serverto.8127: UDP, length 41

13:42:03.190576 IP serverfrom.57671 > serverto.8127: UDP, length 37
13:42:03.190603 IP serverfrom.57671 > serverto.8127: UDP, length 40
13:42:03.190608 IP serverfrom.57671 > serverto.8127: UDP, length 39
13:42:03.190612 IP serverfrom.57671 > serverto.8127: UDP, length 37
13:42:03.190615 IP serverfrom.57671 > serverto.8127: UDP, length 36
13:42:03.190698 IP serverfrom.57671 > serverto.8127: UDP, length 36
13:42:03.590497 IP serverfrom.39823 > serverto.8127: UDP, length 29
13:42:03.590521 IP serverfrom.39823 > serverto.8127: UDP, length 29
13:42:03.590614 IP serverfrom.39823 > serverto.8127: UDP, length 41

13:42:04.042343 IP serverfrom.60197 > serverto.8127: UDP, length 36
13:42:04.042388 IP serverfrom.60197 > serverto.8127: UDP, length 40
13:42:04.042399 IP serverfrom.60197 > serverto.8127: UDP, length 41
13:42:04.042408 IP serverfrom.60197 > serverto.8127: UDP, length 37
13:42:04.042417 IP serverfrom.60197 > serverto.8127: UDP, length 44
13:42:04.042426 IP serverfrom.60197 > serverto.8127: UDP, length 46
13:42:04.042435 IP serverfrom.60197 > serverto.8127: UDP, length 46
13:42:04.127093 IP serverfrom.37307 > serverto.8127: UDP, length 36
13:42:04.127112 IP serverfrom.37307 > serverto.8127: UDP, length 40
13:42:04.127116 IP serverfrom.37307 > serverto.8127: UDP, length 41
13:42:04.127119 IP serverfrom.37307 > serverto.8127: UDP, length 37
13:42:04.127240 IP serverfrom.37307 > serverto.8127: UDP, length 44
13:42:04.127247 IP serverfrom.37307 > serverto.8127: UDP, length 46
13:42:04.127251 IP serverfrom.37307 > serverto.8127: UDP, length 46
13:42:04.127254 IP serverfrom.37307 > serverto.8127: UDP, length 43
13:42:04.127257 IP serverfrom.37307 > serverto.8127: UDP, length 42
13:42:04.127260 IP serverfrom.37307 > serverto.8127: UDP, length 49
13:42:04.127263 IP serverfrom.37307 > serverto.8127: UDP, length 44
13:42:04.592532 IP serverfrom.39823 > serverto.8127: UDP, length 29
13:42:04.592550 IP serverfrom.39823 > serverto.8127: UDP, length 29
13:42:04.592640 IP serverfrom.39823 > serverto.8127: UDP, length 41

13:42:05.594038 IP serverfrom.39823 > serverto.8127: UDP, length 29
13:42:05.594146 IP serverfrom.39823 > serverto.8127: UDP, length 29
13:42:05.594154 IP serverfrom.39823 > serverto.8127: UDP, length 41

13:42:06.596170 IP serverfrom.39823 > serverto.8127: UDP, length 29
13:42:06.596208 IP serverfrom.39823 > serverto.8127: UDP, length 29
13:42:06.596219 IP serverfrom.39823 > serverto.8127: UDP, length 41

13:42:07.597904 IP serverfrom.39823 > serverto.8127: UDP, length 29
13:42:07.597942 IP serverfrom.39823 > serverto.8127: UDP, length 29
13:42:07.597953 IP serverfrom.39823 > serverto.8127: UDP, length 41

13:42:08.200480 IP serverfrom.57671 > serverto.8127: UDP, length 37
13:42:08.200504 IP serverfrom.57671 > serverto.8127: UDP, length 40
13:42:08.200622 IP serverfrom.57671 > serverto.8127: UDP, length 39
13:42:08.200629 IP serverfrom.57671 > serverto.8127: UDP, length 37
13:42:08.200633 IP serverfrom.57671 > serverto.8127: UDP, length 36
13:42:08.200637 IP serverfrom.57671 > serverto.8127: UDP, length 36
13:42:08.599126 IP serverfrom.39823 > serverto.8127: UDP, length 29
13:42:08.599156 IP serverfrom.39823 > serverto.8127: UDP, length 29
13:42:08.599160 IP serverfrom.39823 > serverto.8127: UDP, length 41

13:42:09.051716 IP serverfrom.60197 > serverto.8127: UDP, length 36
13:42:09.051764 IP serverfrom.60197 > serverto.8127: UDP, length 40
13:42:09.051775 IP serverfrom.60197 > serverto.8127: UDP, length 41
13:42:09.051784 IP serverfrom.60197 > serverto.8127: UDP, length 37
13:42:09.051793 IP serverfrom.60197 > serverto.8127: UDP, length 44
13:42:09.051802 IP serverfrom.60197 > serverto.8127: UDP, length 46
13:42:09.051811 IP serverfrom.60197 > serverto.8127: UDP, length 46
13:42:09.136458 IP serverfrom.37307 > serverto.8127: UDP, length 35
13:42:09.136479 IP serverfrom.37307 > serverto.8127: UDP, length 40
13:42:09.136484 IP serverfrom.37307 > serverto.8127: UDP, length 41
13:42:09.136488 IP serverfrom.37307 > serverto.8127: UDP, length 37
13:42:09.136559 IP serverfrom.37307 > serverto.8127: UDP, length 44
13:42:09.136569 IP serverfrom.37307 > serverto.8127: UDP, length 46
13:42:09.136573 IP serverfrom.37307 > serverto.8127: UDP, length 46
13:42:09.136578 IP serverfrom.37307 > serverto.8127: UDP, length 43
13:42:09.136582 IP serverfrom.37307 > serverto.8127: UDP, length 42
13:42:09.136586 IP serverfrom.37307 > serverto.8127: UDP, length 49
13:42:09.136589 IP serverfrom.37307 > serverto.8127: UDP, length 44
13:42:09.600295 IP serverfrom.39823 > serverto.8127: UDP, length 29
13:42:09.600338 IP serverfrom.39823 > serverto.8127: UDP, length 29
13:42:09.600349 IP serverfrom.39823 > serverto.8127: UDP, length 41

13:42:10.602311 IP serverfrom.39823 > serverto.8127: UDP, length 29
13:42:10.602342 IP serverfrom.39823 > serverto.8127: UDP, length 29
13:42:10.602351 IP serverfrom.39823 > serverto.8127: UDP, length 41

13:42:11.604313 IP serverfrom.39823 > serverto.8127: UDP, length 29
13:42:11.604354 IP serverfrom.39823 > serverto.8127: UDP, length 29
13:42:11.604364 IP serverfrom.39823 > serverto.8127: UDP, length 41

13:42:12.606400 IP serverfrom.39823 > serverto.8127: UDP, length 29
13:42:12.606433 IP serverfrom.39823 > serverto.8127: UDP, length 29
13:42:12.606554 IP serverfrom.39823 > serverto.8127: UDP, length 41

13:42:13.210440 IP serverfrom.57671 > serverto.8127: UDP, length 37
13:42:13.210491 IP serverfrom.57671 > serverto.8127: UDP, length 40
13:42:13.210501 IP serverfrom.57671 > serverto.8127: UDP, length 39
13:42:13.210511 IP serverfrom.57671 > serverto.8127: UDP, length 37
13:42:13.210520 IP serverfrom.57671 > serverto.8127: UDP, length 36
13:42:13.210528 IP serverfrom.57671 > serverto.8127: UDP, length 36
13:42:13.608500 IP serverfrom.39823 > serverto.8127: UDP, length 29
13:42:13.608537 IP serverfrom.39823 > serverto.8127: UDP, length 29
13:42:13.608543 IP serverfrom.39823 > serverto.8127: UDP, length 41

13:42:14.061609 IP serverfrom.60197 > serverto.8127: UDP, length 35
13:42:14.061649 IP serverfrom.60197 > serverto.8127: UDP, length 40
13:42:14.061654 IP serverfrom.60197 > serverto.8127: UDP, length 41
13:42:14.061657 IP serverfrom.60197 > serverto.8127: UDP, length 37
13:42:14.061661 IP serverfrom.60197 > serverto.8127: UDP, length 44
13:42:14.061665 IP serverfrom.60197 > serverto.8127: UDP, length 46
13:42:14.061669 IP serverfrom.60197 > serverto.8127: UDP, length 46
13:42:14.061913 IP serverfrom.60197 > serverto.8127: UDP, length 43
13:42:14.061925 IP serverfrom.60197 > serverto.8127: UDP, length 49
13:42:14.061929 IP serverfrom.60197 > serverto.8127: UDP, length 44
13:42:14.061934 IP serverfrom.60197 > serverto.8127: UDP, length 43
13:42:14.061938 IP serverfrom.60197 > serverto.8127: UDP, length 45
13:42:14.061943 IP serverfrom.60197 > serverto.8127: UDP, length 36
13:42:14.061947 IP serverfrom.60197 > serverto.8127: UDP, length 39
13:42:14.061951 IP serverfrom.60197 > serverto.8127: UDP, length 36
13:42:14.061956 IP serverfrom.60197 > serverto.8127: UDP, length 44
13:42:14.148099 IP serverfrom.37307 > serverto.8127: UDP, length 35
13:42:14.148139 IP serverfrom.37307 > serverto.8127: UDP, length 40
13:42:14.148143 IP serverfrom.37307 > serverto.8127: UDP, length 41
13:42:14.148146 IP serverfrom.37307 > serverto.8127: UDP, length 37
13:42:14.148149 IP serverfrom.37307 > serverto.8127: UDP, length 44
13:42:14.148153 IP serverfrom.37307 > serverto.8127: UDP, length 46
13:42:14.148156 IP serverfrom.37307 > serverto.8127: UDP, length 46
13:42:14.148356 IP serverfrom.37307 > serverto.8127: UDP, length 45
13:42:14.148362 IP serverfrom.37307 > serverto.8127: UDP, length 36
13:42:14.148366 IP serverfrom.37307 > serverto.8127: UDP, length 39
13:42:14.148370 IP serverfrom.37307 > serverto.8127: UDP, length 40
13:42:14.148373 IP serverfrom.37307 > serverto.8127: UDP, length 44
13:42:14.619976 IP serverfrom.39823 > serverto.8127: UDP, length 28
13:42:14.620016 IP serverfrom.39823 > serverto.8127: UDP, length 28
13:42:14.620154 IP serverfrom.39823 > serverto.8127: UDP, length 40
^C
1068 packets captured
1376 packets received by filter
307 packets dropped by kernel
```

**Comment by nikobearrr** [comment]
Hello again. I have made some further tests regarding statsd vs graphite. It looks like the issue for us is on statsd. Attached you can see the same data as before, top traph being send through statsd 8125, bottom on graphite 2003. This is the same data as before (and as Image 8). However, now I don't have a singe missing point, which leads me to think the issue is in statsd, how it aggregates data and how it's pushed to carbon. I tried to find some information on this topic. I found this: https://github.com/statsd/statsd/blob/master/docs/graphite.md which specifies we should not have lower statsd flush vs retention settings. In our setup, we use default carbon values, 10s:7d resolution and flushInterval of 10000ms, which (to me) should be OK. Perhaps if you can give me some tips and tricks on how the statsd -> carbon integration works?

Image 12:

<img width="1853" alt="graphite 1 1 7-2 statsd vs graphite" src="https://user-images.githubusercontent.com/8693064/83961813-eb5d8180-a8a7-11ea-8740-883c94d0e608.png">

**Comment by piotr1212** [comment]
Best would be to downgrade Statsd and do some bisection to see from which release it changes.

But if you are able to send your metrics directly to Graphite, why are you using Statsd at all?

**Comment by deniszh** [comment]
1.1.7 using statsd 0.8.6, previous versions have statsd 0.8.5
0.8.6 contains some bugfixes, which were reported before.
I was also thinking with providing alternative to statsd, I have experimental build with [brubeck](https://github.com/lukepalmer/brubeck) in https://github.com/graphite-project/docker-graphite-statsd/tree/DZ-go-carbon, I can build it if you want to test it, @nikobearrr 
But please note that brubeck has different config format and probably some compatibility issues with original statsd.

**Comment by nikobearrr** [comment]
I have been doing some more tests on sending to statsd vs sending to graphite directly and the latter shows much better results for us. We definitelly need to do more tests, but from the looks of it our statsd configuration is causing us issues (or something else), which sendind to graphite doesn't. 

I would like to ask you regarding how graphite works with statsd or: where is statsd in the big picture? I have read statsd's page on github, the FAQs, as well as all the FAQs on graphite. I understand what statsd does, but under circumstances where we don't use statsd (we dont feed it data) will we see any activity? I have seen the graph/diagram here: https://graphite.readthedocs.io/en/latest/faq.html which does not include statsd at all (and the page title is Graphite 1.2.0). However, the docker image itself is called "graphiteapp/graphite-statsd" so that makes me think statsd has something more to do with graphite except for just being a udp listener?

**Comment by deniszh** [comment]
Hi @nikobearrr 
Statsd is separate project and it never been part of Graphite. It has own protocol and using Graphite as backend (for storing metrics). It was included in image because it's useful and was already there (we reused @hobsoft's image for it).
How do you using it in your system? You see some library who can send data to statsd or graphite separately?

**Comment by piotr1212** [comment]
@nikobearrr Graphite only supports fixed interval metrics, you have to send a metric every x seconds, where x is constant. Statsd is created for situations where it is only possible to send metrics at irregular intervals, for example if you can't have a collection thread in you application and want to send events.

If you can send in fixed intervals there is no reason to use Statsd.

**Comment by nikobearrr** [comment]
@deniszh I would expect statsd idling in the background shouldn't take any (much) resources. We use variety of software, some of which has statsd/graphite reporters, some which does not. 

@piotr1212 given we have a resolution 10s:7d, what would happen if we send stats every 5s? is that controlled by the aggregator?

I do have some questions regarding how graphite works, but I am not sure if this is the correct place. However, I am not sure if there is any other graphite forum/posting place.

Regarding my initial issue, which is statsd stats ending up missing, I have read on statsd here: https://github.com/statsd/statsd/blob/master/docs/graphite.md where they say `Graphite's handling of your StatsD metrics should be verified at least once: is data mysteriously lost at any point?`. But based on what I can understand, since we send data every 10s, we flush data every 10s and our retention is 10s we shouldn't end up missing statsd. Perhaps that's more of a question for statsd

**Comment by piotr1212** [comment]
> @piotr1212 given we have a resolution 10s:7d, what would happen if we send stats every 5s? is that controlled by the aggregator?

Set the aggregation to 5s, otherwise last value sent within the interval overwrites the earlier sent.

**Comment by nikobearrr** [comment]
Hi @deniszh and @piotr1212 
While this is still an issue for us (missing points), we are going to try to move away from statsd. My conclusion from all those tests is that statsd does not scale as good as we would like it to. 
However the issue still persists. I don't know if you want to keep this open for further investigation or just close it.

**Comment by piotr1212** [comment]
If the issue is in statsd you can open an issue against the statsd project https://github.com/statsd/statsd. I don't think anyone here will investigate it.
