### ISSUE TITLE
Port the functionality found in #1026 to master

### ISSUE THREAD

**Issue by bmhatfield** [graphite-project/graphite-web#1063]
#1026 parallelizes the updated 0.9.x behavior found in #1010. Unfortunately, it is different enough from master that there's some work involve to get this behavior moved up to it. This issue is to track that work :-)

**Comment by toni-moreno** [comment]
Hi @bmhatfield I'll be happy to test it once merged to master.

**Comment by jjneely** [comment]
#1293 has a small improvement for bulk-fetch and also merges duplicate time series together which I'd like to port to master.  But being this work was based on the bulk-fetch code, I'm blocked until that is also ported to master.

**Comment by obfuscurity** [comment]
@bmhatfield I would buy you **so many** :beers: if you would be inclined to push this along. :smile:

**Comment by deniszh** [comment]
:+1:

**Comment by obfuscurity** [comment]
@bmhatfield any chance you'd be willing to pick this work up again? I personally consider this a "must-have" for a 1.0 release.

**Comment by obfuscurity** [comment]
I would be willing to sponsor this work.

**Comment by cbowman0** [comment]
Does this improve upon the fetch call immediately returning with a callback method that is implemented in master?

**Comment by deniszh** [comment]
Maybe, need to test that.

**Comment by bmhatfield** [comment]
Oh dang, I forgot about this bad boy. I am generally interested but don't see myself being able to carve out time to do this right (ie; stand up something clustered running master and trying it out) over the next few weeks. If it's more urgent than that due to me not doing it before, I am happy to review PRs in lieu of actually writing the code.

**Comment by cbowman0** [comment]
I capture network traffic to confirm what I believed to be happening in master right now.

This was run with one graphite-web instance with no local data and 9 servers holding data.  All running the master branch of graphite-web.  The `/metrics/find` requests happen in quick succession without waiting for a response from each server.  The responses are then processed before issuing the `/render` requests to get data, which happen in the same method.  Here's timestamps and action (manually pulled together for readability):

```
15:01:38.771883 IP ui_instance.48944 > datastore_1.http: GET /metrics/find/?local=1&format=pickle&query=carbon.carbon-daemons.%2A.cache%2A.writer.datapoints_written&from=1471531598&until=1471532498 HTTP/1.1
15:01:38.773039 IP ui_instance.41471 > datastore_2.http: GET /metrics/find/?local=1&format=pickle&query=carbon.carbon-daemons.%2A.cache%2A.writer.datapoints_written&from=1471531598&until=1471532498 HTTP/1.1
15:01:38.774019 IP ui_instance.36074 > datastore_3.http: GET /metrics/find/?local=1&format=pickle&query=carbon.carbon-daemons.%2A.cache%2A.writer.datapoints_written&from=1471531598&until=1471532498 HTTP/1.1
15:01:38.774955 IP ui_instance.54046 > datastore_4.http: GET /metrics/find/?local=1&format=pickle&query=carbon.carbon-daemons.%2A.cache%2A.writer.datapoints_written&from=1471531598&until=1471532498 HTTP/1.1
15:01:38.775897 IP ui_instance.45051 > datastore_5.http: GET /metrics/find/?local=1&format=pickle&query=carbon.carbon-daemons.%2A.cache%2A.writer.datapoints_written&from=1471531598&until=1471532498 HTTP/1.1
15:01:38.777053 IP ui_instance.52152 > datastore_6.http: GET /metrics/find/?local=1&format=pickle&query=carbon.carbon-daemons.%2A.cache%2A.writer.datapoints_written&from=1471531598&until=1471532498 HTTP/1.1
15:01:38.778014 IP ui_instance.46540 > datastore_7.http: GET /metrics/find/?local=1&format=pickle&query=carbon.carbon-daemons.%2A.cache%2A.writer.datapoints_written&from=1471531598&until=1471532498 HTTP/1.1
15:01:38.778999 IP ui_instance.48222 > datastore_8.http: GET /metrics/find/?local=1&format=pickle&query=carbon.carbon-daemons.%2A.cache%2A.writer.datapoints_written&from=1471531598&until=1471532498 HTTP/1.1
15:01:38.780049 IP ui_instance.39282 > datastore_9.http: GET /metrics/find/?local=1&format=pickle&query=carbon.carbon-daemons.%2A.cache%2A.writer.datapoints_written&from=1471531598&until=1471532498 HTTP/1.1

15:01:39.469023 IP datastore_2.http > ui_instance.41471: Find Response
15:01:39.506322 IP datastore_8.http > ui_instance.48222: Find Response
15:01:39.506967 IP datastore_9.http > ui_instance.39282: Find Response
15:01:39.507394 IP datastore_5.http > ui_instance.45051: Find Response
15:01:39.508467 IP datastore_1.http > ui_instance.48944: Find Response
15:01:39.521411 IP datastore_3.http > ui_instance.36074: Find Response
15:01:39.557917 IP datastore_6.http > ui_instance.52152: Find Response
15:01:39.558094 IP datastore_7.http > ui_instance.46540: Find Response
15:01:39.560281 IP datastore_4.http > ui_instance.54046: Find Response

15:01:39.573574 IP ui_instance.52156 > datastore_6.http: GET /render/?target=carbon.carbon-daemons.%2A.cache%2A.writer.datapoints_written&format=pickle&local=1&noCache=1&from=1471531598&until=1471532498 HTTP/1.1
15:01:39.574377 IP ui_instance.36082 > datastore_3.http: GET /render/?target=carbon.carbon-daemons.%2A.cache%2A.writer.datapoints_written&format=pickle&local=1&noCache=1&from=1471531598&until=1471532498 HTTP/1.1
15:01:39.575092 IP ui_instance.39285 > datastore_9.http: GET /render/?target=carbon.carbon-daemons.%2A.cache%2A.writer.datapoints_written&format=pickle&local=1&noCache=1&from=1471531598&until=1471532498 HTTP/1.1
15:01:39.575997 IP ui_instance.41482 > datastore_2.http: GET /render/?target=carbon.carbon-daemons.%2A.cache%2A.writer.datapoints_written&format=pickle&local=1&noCache=1&from=1471531598&until=1471532498 HTTP/1.1
15:01:39.576893 IP ui_instance.48228 > datastore_8.http: GET /render/?target=carbon.carbon-daemons.%2A.cache%2A.writer.datapoints_written&format=pickle&local=1&noCache=1&from=1471531598&until=1471532498 HTTP/1.1
15:01:39.577581 IP ui_instance.45061 > datastore_5.http: GET /render/?target=carbon.carbon-daemons.%2A.cache%2A.writer.datapoints_written&format=pickle&local=1&noCache=1&from=1471531598&until=1471532498 HTTP/1.1
15:01:39.578506 IP ui_instance.46549 > datastore_7.http: GET /render/?target=carbon.carbon-daemons.%2A.cache%2A.writer.datapoints_written&format=pickle&local=1&noCache=1&from=1471531598&until=1471532498 HTTP/1.1
15:01:39.579782 IP ui_instance.48960 > datastore_1.http: GET /render/?target=carbon.carbon-daemons.%2A.cache%2A.writer.datapoints_written&format=pickle&local=1&noCache=1&from=1471531598&until=1471532498 HTTP/1.1
15:01:39.583148 IP ui_instance.54060 > datastore_4.http: GET /render/?target=carbon.carbon-daemons.%2A.cache%2A.writer.datapoints_written&format=pickle&local=1&noCache=1&from=1471531598&until=1471532498 HTTP/1.1

15:01:40.545555 IP datastore_9.http > ui_instance.39285: Render Response
15:01:40.551027 IP datastore_8.http > ui_instance.48228: Render Response
15:01:40.552385 IP datastore_7.http > ui_instance.46549: Render Response
15:01:40.695801 IP datastore_5.http > ui_instance.45061: Render Response
15:01:40.696058 IP datastore_6.http > ui_instance.52156: Render Response
15:01:40.759602 IP datastore_4.http > ui_instance.54060: Render Response
15:02:18.642834 IP datastore_3.http > ui_instance.36041: Render Response
```

So, data to represent that the code in master does issue requests without waiting for the response.

**Comment by deniszh** [comment]
Looks like @cbowman0 is right. Master has megacarbon branch merged, and has async fetcher, for find and read requests. Not sure which way is works better, though - but IMO that can be enough for now.

**Comment by bmhatfield** [comment]
Doing a quick skim of the code and @cbowman0's comment, I think that this is indeed probably 90%.

Issuing the `find` requests is redundant, since calling `render` on a node that doesn't have the series is plenty fast and doesn't require waiting for the results of the find, so there's a speedup probably to be had there. The existing optimization of not issuing `/render/` against nodes that don't have the data is probably not worth it, but they're close enough that it's probably good enough to just go with this.

**Comment by iksaif** [comment]
Is this still an issue with the latest HEAD ?

**Comment by deniszh** [comment]
I think we can close it
