### ISSUE TITLE
Slow response from graphite-web

### ISSUE THREAD

**Issue by Firm** [graphite-project/graphite-web#1319]
Hi,

I'm fighting with recently emerged delays/hangings in Graphite dashboard that result in either non-rendered graphs or empty list of dashboards. /var/log/gunicorn/graphite.log has lots of errors like '[CRITICAL] WORKER TIMEOUT (pid:7626)' and I am trying to figure out what is the root of that. Each back-end has 50-70Mbit of incoming bandwidth (metrics) but there's no evidence that networks issues exist.

When strace-ing one of the processes (16 on each back-end) I found this suspicious graphite-web's behavior:

```
fchmod(20, 01)                          = 0
accept(6, 0x7ffe3cdc93f0, [16])         = -1 EAGAIN (Resource temporarily unavailable)
getppid()                               = 30375
fchmod(20, 0)                           = 0
select(23, [6], [], [21 22], {300, 0})  = 1 (in [6], left {299, 999181})
fchmod(20, 01)                          = 0
accept(6, 0x7ffe3cdc93f0, [16])         = -1 EAGAIN (Resource temporarily unavailable)
getppid()                               = 30375
fchmod(20, 0)                           = 0
select(23, [6], [], [21 22], {300, 0})  = 1 (in [6], left {299, 998939})
fchmod(20, 01)                          = 0
accept(6, 0x7ffe3cdc93f0, [16])         = -1 EAGAIN (Resource temporarily unavailable)
getppid()                               = 30375
fchmod(20, 0)                           = 0
select(23, [6], [], [21 22], {300, 0})  = 1 (in [6], left {299, 999281})
fchmod(20, 01)                          = 0
accept(6, 0x7ffe3cdc93f0, [16])         = -1 EAGAIN (Resource temporarily unavailable)
getppid()                               = 30375
fchmod(20, 0)                           = 0
select(23, [6], [], [21 22], {300, 0})  = 1 (in [6], left {299, 997400})
fchmod(20, 01)                          = 0
accept(6, 0x7ffe3cdc93f0, [16])         = -1 EAGAIN (Resource temporarily unavailable)
getppid()                               = 30375
```

When things run normal, strace-ing looks like:

```
fchmod(20, 0)                           = 0
accept(6, {sa_family=AF_INET, sin_port=htons(60229), sin_addr=inet_addr("X.X.X.X")}, [16]) = 23
fcntl(23, F_GETFL)                      = 0x2 (flags O_RDWR)
fcntl(23, F_SETFL, O_RDWR)              = 0
fcntl(23, F_GETFD)                      = 0
fcntl(23, F_SETFD, FD_CLOEXEC)          = 0
recvfrom(23, "GET /render/?target=mobile"..., 8192, 0, NULL, NULL) = 224
socket(PF_INET, SOCK_STREAM, IPPROTO_IP) = 24
fcntl(24, F_GETFL)                      = 0x2 (flags O_RDWR)
fcntl(24, F_SETFL, O_RDWR|O_NONBLOCK)   = 0
connect(24, {sa_family=AF_INET, sin_port=htons(11211), sin_addr=inet_addr("127.0.0.1")}, 16) = -1 EINPROGRESS (Operation now in progress)
```

Regards,
Alexander

**Comment by obfuscurity** [comment]
Is this related to https://answers.launchpad.net/graphite/+question/271258? If so, can't you please exercise some patience and let me investigate it before opening up a completely separate discussion?

**Comment by Firm** [comment]
Well, they are not related closely. This one can be investigated separately as it has no relation with requests to carbon-cache instances.

**Comment by obfuscurity** [comment]
Similar in what sense... that they're both reporting EAGAIN? That's a normal Python symbol telling the client to try again.

**Comment by Firm** [comment]
I understand that in most cases this means 'no data yet, try again'.

**Comment by obfuscurity** [comment]
Have you tcpdump'ed the traffic to analyze the behavior? The output you've pasted suggests normal behavior on the part of the application.

**Comment by Firm** [comment]
Hi,

tcpdump looks insteresting:

```
12:32:23.498448 IP ip6-localhost.43123 > ip6-localhost.8090: Flags [S], seq 1301429992, win 32768, options [mss 16396,sackOK,TS val 2962778175 ecr 2962778013,nop,wscale 9], length 0
E..<V.@.@............s..M.>..........0....@....
..h?..g....
12:32:23.498474 IP ip6-localhost.8090 > ip6-localhost.43123: Flags [S.], seq 3003916123, ack 1301429993, win 32768, options [mss 16396,sackOK,TS val 2962778175 ecr 2962778175,nop,wscale 9], length 0
E..<..@.@.<............s...[M.>......0....@....
..h?..h?...
12:32:23.498496 IP ip6-localhost.43123 > ip6-localhost.8090: Flags [.], ack 1, win 64, options [nop,nop,TS val 2962778175 ecr 2962778175], length 0
E..4V.@.@............s..M.>....\...@.(.....
..h?..h?
12:32:23.498539 IP ip6-localhost.43123 > ip6-localhost.8090: Flags [P.], seq 1:241, ack 1, win 64, options [nop,nop,TS val 2962778175 ecr 2962778175], length 240
E..$V.@.@............s..M.>....\...@.......
..h?..h?GET /dashboard/find/ HTTP/1.0
Host: gweb.XXX.XX
X-Real-IP: X.X.X.X
Connection: close
User-Agent: curl/7.19.7 (x86_64-redhat-linux-gnu) libcurl/7.19.7 NSS/3.16.2.3 Basic ECC zlib/1.2.3 libidn/1.18 libssh2/1.4.2
Accept: */*


12:32:23.498552 IP ip6-localhost.8090 > ip6-localhost.43123: Flags [.], ack 241, win 64, options [nop,nop,TS val 2962778175 ecr 2962778175], length 0
E..4wc@.@..^...........s...\M.?....@.(.....
..h?..h?
```

**Comment by Firm** [comment]
Further investigating found that graphite app gets stuck after we added more metrics (5 mln->7 mln) while using a lot of aggregating functions for groups of hosts/metrics. If I increase memcached cache time from 1 min to 10 then things get better. But I need more granular (even 5-10 seconds max caching time). Even increasing number of graphite apps from 16 to 32 don't help much.
